,title,link
0,Generative Modeling for Multitask Visual Learning,https://openreview.net/forum?id=youe3QQepVB
1,Where is the bottleneck in long-tailed classification?,https://openreview.net/forum?id=2aC0_RxkBL_
2,Additive Poisson Process: Learning Intensity of Higher-Order Interaction in Poisson Processes,https://openreview.net/forum?id=voEpzgY8gsT
3,Brain insights improve RNNs' accuracy and robustness for hierarchical control of continually learned autonomous motor motifs,https://openreview.net/forum?id=qfLJBJf_DnH
4,VUT: Versatile UI Transformer for Multimodal Multi-Task User Interface Modeling,https://openreview.net/forum?id=rF5UoZFrsF4
5,DreamerPro: Reconstruction-Free Model-Based Reinforcement Learning with Prototypical Representations,https://openreview.net/forum?id=3M3t3tUbA2Y
6,Recognizing and overcoming the greedy nature of learning in multi-modal deep neural networks,https://openreview.net/forum?id=Dy8gq-LuckD
7,Subjective Learning for Open-Ended Data,https://openreview.net/forum?id=UeE41VsK1KJ
8,KINet: Keypoint Interaction Networks for Unsupervised Forward Modeling,https://openreview.net/forum?id=2RNpZ8S4alJ
9,Deep banach space kernels,https://openreview.net/forum?id=an_ndI09oVZ
10,Gesture2Vec: Clustering Gestures using Representation Learning Methods for Co-speech Gesture Generation,https://openreview.net/forum?id=0Kj5mhn6sw
11,Logit Attenuating Weight Normalization,https://openreview.net/forum?id=WXy4C-RjET
12,Revisiting the Lottery Ticket Hypothesis: A Ramanujan Graph Perspective,https://openreview.net/forum?id=UxBH9j8IE_H
13,Stochastic Projective Splitting: Solving Saddle-Point Problems with Multiple Regularizers,https://openreview.net/forum?id=a0SRWViFYW
14,RieszNet and ForestRiesz: Automatic Debiased Machine Learning with Neural Nets and Random Forests,https://openreview.net/forum?id=_K6rwRjW9WO
15,New Definitions and Evaluations for Saliency Methods: Staying Intrinsic and Sound,https://openreview.net/forum?id=Mo9R9oqzPo
16,Selective Token Generation for Few-shot Language Modeling,https://openreview.net/forum?id=GthNKCqdDg
17,Adversarial Distributions Against Out-of-Distribution Detectors,https://openreview.net/forum?id=INO8hGXD2M
18,On the Implicit Biases of Architecture & Gradient Descent,https://openreview.net/forum?id=eOdSD0B5TE
19,PACE: A Parallelizable Computation Encoder for Directed Acyclic Graphs,https://openreview.net/forum?id=vPK-G5HbnWg
20,Proper Straight-Through Estimator: Breaking symmetry promotes convergence to true minimum,https://openreview.net/forum?id=hEiwVblq4P
21,Ask2Mask: Guided Data Selection for Masked Speech Modeling,https://openreview.net/forum?id=W6BpshgRi0q
22,Boosting the Confidence of Near-Tight Generalization Bounds for Uniformly Stable Randomized Algorithms,https://openreview.net/forum?id=ZWykq5n4zx
23,How to Adapt Your Large-Scale Vision-and-Language Model,https://openreview.net/forum?id=EhwEUb2ynIa
24,Fast Finite Width Neural Tangent Kernel,https://openreview.net/forum?id=zLb9oSWy933
25,SpanDrop: Simple and Effective Counterfactual Learning for Long Sequences,https://openreview.net/forum?id=zaALYtvbRlH
26,Embedding models through the lens of Stable Coloring,https://openreview.net/forum?id=PC8u74o7xc2
27,Tesseract: Gradient Flip Score to Secure Federated Learning against Model Poisoning Attacks,https://openreview.net/forum?id=XIZaWGCPl0b
28,CareGraph: A Graph-based Recommender System for Diabetes Self-Care,https://openreview.net/forum?id=rX3rZYP8zZF
29,"Self-Supervise, Refine, Repeat: Improving Unsupervised Anomaly Detection",https://openreview.net/forum?id=Nct9j3BVswZ
30,DNBP: Differentiable Nonparametric Belief Propagation,https://openreview.net/forum?id=QKEkEFpKBBv
31,I-PGD-AT: Efficient Adversarial Training via Imitating Iterative PGD Attack,https://openreview.net/forum?id=TEt7PsVZux6
32,"Why so pessimistic? Estimating uncertainties for offline RL through ensembles, and why their independence matters.",https://openreview.net/forum?id=wQ7RCayXUSl
33,"A Large Batch Optimizer Reality Check: Traditional, Generic Optimizers Suffice Across Batch Sizes",https://openreview.net/forum?id=E9e18Ms5TeV
34,Improving greedy core-set configurations for active learning with uncertainty-scaled distances,https://openreview.net/forum?id=5ueTHF0yAlZ
35,On the Relationship between Heterophily and Robustness of Graph Neural Networks,https://openreview.net/forum?id=Nus6fOfh1HW
36,Word Sense Induction with Knowledge Distillation from BERT,https://openreview.net/forum?id=-29uFS4FiDZ
37,Learning Surface Parameterization for Document Image Unwarping,https://openreview.net/forum?id=PGGjnBiQ84G
38,EqR: Equivariant Representations for Data-Efficient Reinforcement Learning,https://openreview.net/forum?id=4JlwgTbmzXQ
39,Explore and Control with Adversarial Surprise,https://openreview.net/forum?id=JHXjK94yH-y
40,Logical Activation Functions: Logit-space equivalents of Boolean Operators,https://openreview.net/forum?id=Ck_iw4jMC4l
41,Continual Learning Using Task Conditional Neural Networks,https://openreview.net/forum?id=ofLwshMBL_H
42,A Boosting Approach to Reinforcement Learning,https://openreview.net/forum?id=xspalMXAB0M
43,Universal Joint Approximation of Manifolds and Densities by Simple Injective Flows,https://openreview.net/forum?id=HUeyM2qVey2
44,GrASP: Gradient-Based Affordance Selection for Planning,https://openreview.net/forum?id=zrdUVVAvcP2
45,Metric Learning on Temporal Graphs via Few-Shot Examples,https://openreview.net/forum?id=14kbUbOaZUc
46,Scalable multimodal variational autoencoders with surrogate joint posterior,https://openreview.net/forum?id=a61qArWbjw_
47,Semi-supervised Offline Reinforcement Learning with Pre-trained Decision Transformers,https://openreview.net/forum?id=fwJWhOxuzV9
48,Increase and Conquer: Training Graph Neural Networks on Growing Graphs,https://openreview.net/forum?id=_Ko4kT3ckWy
49,Multi-Trigger-Key: Towards Multi-Task Privacy-Preserving In Deep Learning,https://openreview.net/forum?id=MQuxKr2F1Xw
50,Towards General Robustness to Bad Training Data,https://openreview.net/forum?id=kz6rsFehYjd
51,Multiresolution Equivariant Graph Variational Autoencoder,https://openreview.net/forum?id=qyzTEWWM0Pp
52,Unifying Top-down and Bottom-up for Recurrent Visual Attention,https://openreview.net/forum?id=kUGYDTJUcuc
53,"Specialized Transformers: Faster, Smaller and more Accurate NLP Models",https://openreview.net/forum?id=aUoV6qhY_e
54,Geometric Random Walk Graph Neural Networks via Implicit Layers,https://openreview.net/forum?id=eV5d4I3eso
55,Curriculum Discovery through an Encompassing Curriculum Learning Framework,https://openreview.net/forum?id=LGTmlJ10Kes
56,Pretraining for Language Conditioned Imitation with Transformers,https://openreview.net/forum?id=eCPCn25gat
57,The weighted mean trick â€“ optimization strategies for robustness,https://openreview.net/forum?id=CES-KyrKcTM
58,Detecting Worst-case Corruptions via Loss Landscape Curvature in Deep Reinforcement Learning,https://openreview.net/forum?id=f7cWROZYSU
59,Graph Piece: Efficiently Generating High-Quality Molecular Graphs with Substructures,https://openreview.net/forum?id=R0xRE2MU2uA
60,Influence-Based Reinforcement Learning for Intrinsically-Motivated Agents,https://openreview.net/forum?id=bxiDvWZm6zU
61,Learning Efficient and Robust Ordinary Differential Equations via Diffeomorphisms,https://openreview.net/forum?id=r9cpyzP-DQ
62,AutoOED: Automated Optimal Experimental Design Platform with Data- and Time-Efficient Multi-Objective Optimization,https://openreview.net/forum?id=morSrUyWG26
63,A Frequency Perspective of Adversarial Robustness,https://openreview.net/forum?id=7gRvcAulxa
64,Sharp Attention for Sequence to Sequence Learning,https://openreview.net/forum?id=UvNXZgJAOAP
65,Spectral Bias in Practice: the Role of Function Frequency in Generalization,https://openreview.net/forum?id=e-IkMkna5uJ
66,Patches Are All You Need?,https://openreview.net/forum?id=TVHS5Y4dNvM
67,Maximum Likelihood Estimation for Multimodal Learning with Missing Modality,https://openreview.net/forum?id=Vt1lpp5Vebd
68,Target Propagation via Regularized Inversion,https://openreview.net/forum?id=MTsBazXmX00
69,Low-Cost Algorithmic Recourse for Users With Uncertain Cost Functions,https://openreview.net/forum?id=RNnKhz25N1O
70,L-SR1 Adaptive Regularization by Cubics for Deep Learning,https://openreview.net/forum?id=dHd6pU-8_fF
71,Offline Reinforcement Learning with Resource Constrained Online Deployment,https://openreview.net/forum?id=_xxbJ7oSJXX
72,Efficient Certification for Probabilistic Robustness,https://openreview.net/forum?id=KNfuensPHDU
73,Factored World Models for Zero-Shot Generalization in Robotic Manipulation,https://openreview.net/forum?id=GOr80bgf52v
74,Disentangling One Factor at a Time,https://openreview.net/forum?id=DXU0DQUDWLA
75,Learning Sample Reweighting for Adversarial Robustness,https://openreview.net/forum?id=7zc05Ua_HOK
76,Convergence Analysis and Implicit Regularization of Feedback Alignment for Deep Linear Networks,https://openreview.net/forum?id=SgEhFeRyzEZ
77,Learning a metacognition for object detection,https://openreview.net/forum?id=8CEJlHbKoP4
78,Logarithmic landscape and power-law escape rate of SGD,https://openreview.net/forum?id=rqolQhuq6Hs
79,WHY FLATNESS DOES AND DOES NOT CORRELATE WITH GENERALIZATION FOR DEEP NEURAL NETWORKS,https://openreview.net/forum?id=L1L2G43k14n
80,Limitations of Active Learning With Deep Transformer Language Models,https://openreview.net/forum?id=Q8OjAGkxwP5
81,Understanding the Generalization of Adam in Learning Neural Networks with Proper Regularization,https://openreview.net/forum?id=G7PfyLimZBp
82,Exploring unfairness in Integrated Gradients based attribution methods,https://openreview.net/forum?id=Ivku4TZgEly
83,Conditional Expectation based Value Decomposition for Scalable On-Demand Ride Pooling,https://openreview.net/forum?id=reFFte7mA0F
84,Multi-scale Feature Learning Dynamics: Insights for Double Descent,https://openreview.net/forum?id=JmU7lyDxTpc
85,Efficient and Modular Implicit Differentiation,https://openreview.net/forum?id=TQ75Md-FqQp
86,Avoiding Robust Misclassifications for Improved Robustness without Accuracy Loss,https://openreview.net/forum?id=kUtux8k0G6y
87,Faster No-Regret Learning Dynamics for Extensive-Form Correlated Equilibrium,https://openreview.net/forum?id=a3mRgptHKZd
88,Iterative Sketching and its Application to Federated Learning,https://openreview.net/forum?id=U_Jog0t3fAu
89,ZeroSARAH: Efficient Nonconvex Finite-Sum Optimization with Zero Full Gradient Computations,https://openreview.net/forum?id=LQnyIk5dUA
90,VIMPAC: Video Pre-Training via Masked Token Prediction and Contrastive Learning,https://openreview.net/forum?id=NP9T_pViXU
91,Programmable 3D snapshot microscopy with Fourier convolutional networks,https://openreview.net/forum?id=fuYtttFI-By
92,TimeVAE: A Variational Auto-Encoder for Multivariate Time Series Generation,https://openreview.net/forum?id=VDdDvnwFoyM
93,Quantifying the Controllability of Coarsely Characterized Networked Dynamical Systems,https://openreview.net/forum?id=okmZ6-zU6Lz
94,HyperTransformer: Attention-Based CNN Model Generation from Few Samples,https://openreview.net/forum?id=E9z2A1-O7e
95,Nonparametric Learning of Two-Layer ReLU Residual Units,https://openreview.net/forum?id=1uf_kj0GUF-
96,Connecting Graph Convolution and Graph PCA,https://openreview.net/forum?id=SVey0ddzC4
97,Using Document Similarity Methods to create Parallel Datasets for Code Translation,https://openreview.net/forum?id=CO0ZuH5vaMu
98,PKCAM: Previous Knowledge Channel Attention Module,https://openreview.net/forum?id=X3WxnuzAYyE
99,Meta-Referential Games to Learn Compositional Learning Behaviours,https://openreview.net/forum?id=ffS_Y258dZs
100,Where can quantum kernel methods make a big difference?,https://openreview.net/forum?id=NoE4RfaOOa
101,Learning to Efficiently Sample from Diffusion Probabilistic Models,https://openreview.net/forum?id=LOz0xDpw4Y
102,An Investigation into the Role of Author Demographics in ICLR Participation and Review,https://openreview.net/forum?id=1DUwCRNAbA
103,Effects of Data Geometry in Early Deep Learning,https://openreview.net/forum?id=vKMVrqvXbXu
104,Design in the Dark: Learning Deep Generative Models for De Novo Protein Design,https://openreview.net/forum?id=WQVouCWioh
105,Information-theoretic stochastic contrastive conditional GAN: InfoSCC-GAN,https://openreview.net/forum?id=2M0WXSP6Qi
106,Defending Backdoor Data Poisoning Attacks by Using Noisy Label Defense Algorithm,https://openreview.net/forum?id=2_dQlkDHnvN
107,Degradation Attacks on Certifiably Robust Neural Networks,https://openreview.net/forum?id=on54StZqGQ_
108,Mixture Representation Learning with Coupled Autoencoders,https://openreview.net/forum?id=R-piejobttn
109,Generalization to Out-of-Distribution transformations,https://openreview.net/forum?id=YxWU4YZ4Cr
110,TorchGeo: deep learning with geospatial data,https://openreview.net/forum?id=ZgV2C9NKk6Q
111,A Survey on Evidential Deep Learning For Single-Pass Uncertainty Estimation,https://openreview.net/forum?id=UI4K-I2ypG
112,DATA-DRIVEN EVALUATION OF TRAINING ACTION SPACE FOR REINFORCEMENT LEARNING,https://openreview.net/forum?id=TTnjervir3J
113,Kokoyi: Executable LaTeX for End-to-end Deep Learning,https://openreview.net/forum?id=OZ_2rF2D4Nw
114,Practical Adversarial Attacks on Brain--Computer Interfaces,https://openreview.net/forum?id=0sEIBFb4cs
115,Input Dependent Sparse Gaussian Processes,https://openreview.net/forum?id=HL_qE4fz-JZ
116,Scalable Robust Federated Learning with Provable Security Guarantees,https://openreview.net/forum?id=BsDYmsrCjr
117,Neural Bootstrapping Attention for Neural Processes,https://openreview.net/forum?id=Z7VhFVRVqeU
118,Adversarially Robust Models may not Transfer Better: Sufficient Conditions for Domain Transferability from the View of Regularization,https://openreview.net/forum?id=_ixHFNR-FZ
119,Parallel Deep Neural Networks Have Zero Duality Gap,https://openreview.net/forum?id=9BIN1yr5Gp
120,FSL: Federated Supermask Learning,https://openreview.net/forum?id=nT0GS37Clr
121,Improving and Assessing Anomaly Detectors for Large-Scale Settings,https://openreview.net/forum?id=vruwp11pWnO
122,Value-aware transformers for 1.5d data,https://openreview.net/forum?id=S3qhbZwzq3H
123,"Poisoned classifiers are not only backdoored, they are fundamentally broken",https://openreview.net/forum?id=rwEv1SklKFt
124,Spectral Multiplicity Entails Sample-wise Multiple Descent,https://openreview.net/forum?id=qaQ8kUBYhEK
125,The guide and the explorer: smart agents for resource-limited iterated batch reinforcement learning,https://openreview.net/forum?id=G9JXCpShpni
126,FedLite: A Scalable Approach for Federated Learning on Resource-constrained Clients,https://openreview.net/forum?id=cLcLdwOfhoe
127,On Convergence of Federated Averaging Langevin Dynamics,https://openreview.net/forum?id=LUpE0A3Q-wz
128,Attention: Self-Expression Is All You Need,https://openreview.net/forum?id=MmujBClawFo
129,Revealing the Incentive to Cause Distributional Shift,https://openreview.net/forum?id=mMiKHj7Pobj
130,Language Models as Zero-Shot Planners: Extracting Actionable Knowledge for Embodied Agents,https://openreview.net/forum?id=6NT1a56mNim
131,Ensemble Kalman Filter (EnKF) for Reinforcement Learning (RL),https://openreview.net/forum?id=y8zhHLm7FsP
132,On the exploitative behavior of adversarial training against adversarial attacks,https://openreview.net/forum?id=TfwF7pqwqdm
133,Teacher's pet: understanding and mitigating biases in distillation,https://openreview.net/forum?id=WDBo7y8lcJm
134,Zero-Shot Reward Specification via Grounded Natural Language,https://openreview.net/forum?id=zRb7IWkTZAU
135,Learning Symmetric Representations for Equivariant World Models,https://openreview.net/forum?id=D637S6zBRLD
136,Neural Networks Playing Dough: Investigating Deep Cognition With a Gradient-Based Adversarial Attack,https://openreview.net/forum?id=1iDVz-khM4P
137,Interrogating Paradigms in Self-supervised Graph Representation Learning,https://openreview.net/forum?id=yRYtnKAZqxU
138,Learning to Shape Rewards using a Game of Two Partners,https://openreview.net/forum?id=74cDdRwm4NV
139,Understanding and Improving Robustness of Vision Transformers through Patch-based Negative Augmentation,https://openreview.net/forum?id=qZNw8Ao_BIC
140,Enforcing physics-based algebraic constraints for inference of PDE models on unstructured grids,https://openreview.net/forum?id=JEoDctbwCmP
141,Geometric Algebra Attention Networks for Small Point Clouds,https://openreview.net/forum?id=nLb60uXd6Np
142,rQdia: Regularizing Q-Value Distributions With Image Augmentation,https://openreview.net/forum?id=rqcLsG8Kme9
143,HD-cos Networks: Efficient Neural Architechtures for Secure Multi-Party Computation,https://openreview.net/forum?id=2yITmG7YIFT
144,WaveSense: Efficient Temporal Convolutions with Spiking Neural Networks for Keyword Spotting,https://openreview.net/forum?id=_3bwD_KXl5K
145,GRAPHIX: A Pre-trained Graph Edit Model for Automated Program Repair,https://openreview.net/forum?id=uB12zutkXJR
146,Hybrid Cloud-Edge Networks for Efficient Inference,https://openreview.net/forum?id=2DJwuD-elOt
147,STRIC: Stacked Residuals of Interpretable Components for Time Series Anomaly Detection,https://openreview.net/forum?id=VnurXbqxr0B
148,Escaping Saddle Points in Nonconvex Minimax Optimization via Cubic-Regularized Gradient Descent-Ascent,https://openreview.net/forum?id=nEfdkfAyRT8
149,Image2Point: 3D Point-Cloud Understanding with 2D Image Pretrained Models,https://openreview.net/forum?id=tJCwZBHm-jW
150,Sample and Communication-Efficient Decentralized Actor-Critic Algorithms with Finite-Time Analysis,https://openreview.net/forum?id=Ew4hVmrrqJE
151,Contextual Multi-Armed Bandit with Communication Constraints,https://openreview.net/forum?id=-spj8FZD4y2
152,Benchmarking Sample Selection Strategies for Batch Reinforcement Learning,https://openreview.net/forum?id=WxBFVNbDUT6
153,Attentional meta-learners for few-shot polythetic classification,https://openreview.net/forum?id=-uPIaaZdMLF
154,Offline Meta-Reinforcement Learning with Online Self-Supervision,https://openreview.net/forum?id=s3V9I71JvkD
155,"The Role of Learning Regime, Architecture and Dataset Structure on Systematic Generalization in Simple Neural Networks",https://openreview.net/forum?id=3r034NfDKnL
156,Deep Probability Estimation,https://openreview.net/forum?id=hdSn_X7Hfvz
157,LPRules: Rule Induction in Knowledge Graphs Using Linear Programming,https://openreview.net/forum?id=7QDPaL-Yl8U
158,Less data is more: Selecting informative and diverse subsets with balancing constraints,https://openreview.net/forum?id=6PlIkYUK9As
159,Autoregressive Latent Video Prediction with High-Fidelity Image Generator,https://openreview.net/forum?id=K-hiHQXEQog
160,Learning Identity-Preserving Transformations on Data Manifolds,https://openreview.net/forum?id=JsfFpJhI4BV
161,Generalized Fourier Features for Coordinate-Based Learning of Functions on Manifolds,https://openreview.net/forum?id=g6UqpVislvH
162,Multi-batch Reinforcement Learning via Sample Transfer and Imitation Learning,https://openreview.net/forum?id=KTF1h2XWKZA
163,Task-Agnostic Graph Neural Explanations,https://openreview.net/forum?id=NQrx8EYMboO
164,Characterizing and Measuring the Similarity of Neural Networks with Persistent Homology,https://openreview.net/forum?id=Lwclw6u3Pcw
165,Explaining Scaling Laws of Neural Network Generalization,https://openreview.net/forum?id=FvfV64rovnY
166,Distributionally Robust Learning for Uncertainty Calibration under Domain Shift,https://openreview.net/forum?id=FZyZiRYbdK8
167,Persistent Homology Captures the Generalization of Neural Networks Without A Validation Set,https://openreview.net/forum?id=TNxKD3z_tPZ
168,Training sequence labeling models using prior knowledge,https://openreview.net/forum?id=H6mR1eaBP1l
169,Assisted Learning for Organizations with Limited Imbalanced Data,https://openreview.net/forum?id=YqHW0o9wXae
170,TRAKR â€“ A reservoir-based tool for fast and accurate classification of neural time-series patterns,https://openreview.net/forum?id=qESp3gXBm2g
171,Generating Scenes with Latent Object Models,https://openreview.net/forum?id=WTXMNULQ3Uu
172,Advancing Nearest Neighbor Explanation-by-Example with Critical Classification Regions,https://openreview.net/forum?id=sBT5nxwt18Q
173,C-MinHash: Improving Minwise Hashing with Circulant Permutation,https://openreview.net/forum?id=NrkAAcMpRoT
174,Analyzing Populations of Neural Networks via Dynamical Model Embedding,https://openreview.net/forum?id=xbu1tzbjvd
175,Neural Temporal Logic Programming,https://openreview.net/forum?id=i7h4M45tU8
176,Mind Your Bits and Errors: Prioritizing the Bits that Matter in Variational Autoencoders,https://openreview.net/forum?id=-0LuSWi6j4
177,Federated Inference through Aligning Local Representations and Learning a Consensus Graph,https://openreview.net/forum?id=DFYtZFo_1u
178,Towards Understanding Label Smoothing,https://openreview.net/forum?id=wMXYbJB-gX
179,Beyond Prioritized Replay: Sampling States in Model-Based Reinforcement Learning via Simulated Priorities,https://openreview.net/forum?id=FNSR8Okx8a
180,DP-REC: Private & Communication-Efficient Federated Learning,https://openreview.net/forum?id=b-ZaBVGx8Q
181,Provably Robust Detection of Out-of-distribution Data (almost) for free,https://openreview.net/forum?id=qDx6DXD3Fzt
182,k-Median Clustering via Metric Embedding: Towards Better Initialization with Privacy,https://openreview.net/forum?id=beUek8ku1Q
183,Boundary Graph Neural Networks for 3D Simulations,https://openreview.net/forum?id=ePI0bPbrih
184,Inductive Biases and Variable Creation in Self-Attention Mechanisms,https://openreview.net/forum?id=UjynxfqnGWG
185,Revisiting Locality-Sensitive Binary Codes from Random Fourier Features,https://openreview.net/forum?id=TH7crDRRND
186,Defending Against Backdoor Attacks Using Ensembles of Weak Learners,https://openreview.net/forum?id=dEelotBE6e2
187,Unsupervised Neural Machine Translation with Generative Language Models Only,https://openreview.net/forum?id=SVwbKmEg7M
188,Symmetry-driven graph neural networks,https://openreview.net/forum?id=nRCS3BfynGQ
189,RainNet: A Large-Scale Imagery Dataset for Spatial Precipitation Downscaling,https://openreview.net/forum?id=6p8D4V_Wmyp
190,Mixed-Memory RNNs for Learning Long-term Dependencies in Irregularly Sampled Time Series,https://openreview.net/forum?id=rOGm97YR22N
191,Search Spaces for Neural Model Training,https://openreview.net/forum?id=J8P7g_mDpno
192,Multilevel physics informed neural networks (MPINNs),https://openreview.net/forum?id=g5odb-gVVZY
193,AestheticNet: Reducing bias in facial data sets under ethical considerations,https://openreview.net/forum?id=Eot1M5o2Zy
194,Hierarchically Regularized Deep Forecasting,https://openreview.net/forum?id=_Vn-mKDipa1
195,Scaling-up Diverse Orthogonal Convolutional Networks by a Paraunitary Framework,https://openreview.net/forum?id=t2LJBsPxQM
196,Learning-Augmented Sketches for Hessians,https://openreview.net/forum?id=Vvb-eicR8N
197,Learning shared neural manifolds from multi-subject FMRI data,https://openreview.net/forum?id=8uqOMUHgW4M
198,Fair Node Representation Learning via Adaptive Data Augmentation,https://openreview.net/forum?id=4pijrj4H_B
199,Meaningfully Explaining Model Mistakes Using Conceptual Counterfactuals,https://openreview.net/forum?id=U-_89RnR8F
200,Robust Losses for Learning Value Functions,https://openreview.net/forum?id=P1zfguZHowl
201,Feudal Reinforcement Learning by Reading Manuals,https://openreview.net/forum?id=ghTlLwlBS-
202,Propagating Distributions through Neural Networks,https://openreview.net/forum?id=4GBHVfEcmoS
203,A Principled Permutation Invariant Approach to Mean-Field Multi-Agent Reinforcement Learning,https://openreview.net/forum?id=H4J8FGHOhx_
204,Where do Models go Wrong? Parameter-Space Saliency Maps for Explainability,https://openreview.net/forum?id=qEGBB9YB31
205,Novelty detection using ensembles with regularized disagreement,https://openreview.net/forum?id=qO-PN1zjmi_
206,Guiding Transformers to Process in Steps,https://openreview.net/forum?id=lu_DAxnWsh
207,Introspective Learning : A Two-Stage approach for Inference in Neural Networks,https://openreview.net/forum?id=in1ynkrXyMH
208,C5T5: Controllable Generation of Organic Molecules with Transformers,https://openreview.net/forum?id=ezbMFmQY7L
209,Compressed-VFL: Communication-Efficient Learning with Vertically Partitioned Data,https://openreview.net/forum?id=lvM693mon8q
210,Causal Reinforcement Learning using Observational and Interventional Data,https://openreview.net/forum?id=RW_GTtTfHJ6
211,Data Sharing without Rewards in Multi-Task Offline Reinforcement Learning,https://openreview.net/forum?id=gfUPGPMxB7E
212,Dominant Datapoints and the Block Structure Phenomenon in Neural Network Hidden Representations,https://openreview.net/forum?id=1ch9DLxqF-
213,On Optimal Early Stopping: Overparametrization versus Underparametrization,https://openreview.net/forum?id=LQCUmLgFlR
214,Resmax: An Alternative Soft-Greedy Operator for Reinforcement Learning,https://openreview.net/forum?id=RjMtFbmETG
215,"Rethinking the limiting dynamics of SGD: modified loss, phase space oscillations, and anomalous diffusion",https://openreview.net/forum?id=mRc_t2b3l1-
216,Adversarial Style Transfer for Robust Policy Optimization in Reinforcement Learning,https://openreview.net/forum?id=S0NsaRIxvQ
217,Domain Invariant Adversarial Learning,https://openreview.net/forum?id=bUAdXW8wN6
218,"Multi-Tailed, Multi-Headed, Spatial Dynamic Memory refined Text-to-Image Synthesis",https://openreview.net/forum?id=SN2bkl9f69
219,Learning Stable Classifiers by Transferring Unstable Features,https://openreview.net/forum?id=xs-tJn58XKv
220,Connectivity Matters: Neural Network Pruning Through the Lens of Effective Sparsity,https://openreview.net/forum?id=YgR1rRWETI
