,title,link
878,On the Impact of Hard Adversarial Instances on Overfitting in Adversarial Training,https://openreview.net/forum?id=hbGV3vzMPzG
879,How to decay your learning rate,https://openreview.net/forum?id=biyvmQe5jM
880,A Two-Stage Neural-Filter Pareto Front Extractor and the need for Benchmarking,https://openreview.net/forum?id=UOj0MV__Cr
881,Sphere2Vec: Self-Supervised Location Representation Learning on Spherical Surfaces,https://openreview.net/forum?id=FS0XKbpkdOu
882,The NTK Adversary: An Approach to Adversarial Attacks without any Model Access,https://openreview.net/forum?id=M5hiCgL7qt
883,Range-Net: A High Precision Neural SVD,https://openreview.net/forum?id=4lLyoISm9M
884,Understanding Metric Learning on Unit Hypersphere and Generating Better Examples for Adversarial Training,https://openreview.net/forum?id=DkeCkhLIVGZ
885,NormFormer: Improved Transformer Pretraining with Extra Normalization,https://openreview.net/forum?id=GMYWzWztDx5
886,Quasi-Newton policy gradient algorithms,https://openreview.net/forum?id=GBszJ1XlKDj
887,Encoding Event-Based Gesture Data With a Hybrid SNN Guided Variational Auto-encoder,https://openreview.net/forum?id=Nn4BjABPRPN
888,Adversarial Weight Perturbation Improves Generalization in Graph Neural Networks,https://openreview.net/forum?id=hUr6K4D9f7P
889,Equalized Robustness: Towards Sustainable Fairness Under Distributional Shifts,https://openreview.net/forum?id=-dzXGe2FyW6
890,Towards Generalizable Personalized Federated Learning with Adaptive Local Adaptation,https://openreview.net/forum?id=EFSctTwY4xn
891,Layer-wise Adaptive Model Aggregation for Scalable Federated Learning,https://openreview.net/forum?id=Ps_m_Uwcu-E
892,DFSSATTEN: Dynamic Fine-grained Structured Sparse Attention Mechanism,https://openreview.net/forum?id=agBJ7SYcUVb
893,Loss Function Learning for Domain Generalization by Implicit Gradient,https://openreview.net/forum?id=OxgLa0VEyg-
894,Multi-Domain Self-Supervised Learning,https://openreview.net/forum?id=eIvzaLx6nKW
895,An Application of Pseudo-log-likelihoods to Natural Language Scoring,https://openreview.net/forum?id=6-lLt2zxbZR
896,Human-Level Control without Server-Grade Hardware,https://openreview.net/forum?id=KDAEc2nai83
897,Fragment-Based Sequential Translation for Molecular Optimization,https://openreview.net/forum?id=IY6Zt3Qu0cT
898,Learning Temporally-Consistent Representations for Data-Efficient Reinforcement Learning,https://openreview.net/forum?id=s51gCxF70pq
899,Training Data Size Induced Double Descent For Denoising Neural Networks and the Role of Training Noise Level,https://openreview.net/forum?id=5ALGcXpmFyC
900,Unifying Distribution Alignment as a Loss for Imbalanced Semi-supervised Learning,https://openreview.net/forum?id=HHUSDJb_4KJ
901,Efficient Packing: Towards 2x NLP Speed-Up without Loss of Accuracy for BERT,https://openreview.net/forum?id=ms7xJWbf8Ku
902,Sequoia: A Software Framework to Unify Continual Learning Research,https://openreview.net/forum?id=xWRX16GCugt
903,Avoiding Overfitting to the Importance Weights in Offline Policy Optimization,https://openreview.net/forum?id=dLTXoSIcrik
904,Design and Evaluation for Robust Continual Learning,https://openreview.net/forum?id=aNCZ8151BjY
905,Cross-Architecture Distillation Using Bidirectional CMOW Embeddings,https://openreview.net/forum?id=o9DnX55PEAo
906,SAFER: Data-Efficient and Safe Reinforcement Learning Through Skill Acquisition,https://openreview.net/forum?id=xwAw8QZkpWZ
907,Monotonicity as a requirement and as a regularizer: efficient methods and applications,https://openreview.net/forum?id=97ru13Fdmbt
908,Local Calibration: Metrics and Recalibration,https://openreview.net/forum?id=T_p2GaXuGeA
909,Learning When and What to Ask: a Hierarchical Reinforcement Learning Framework,https://openreview.net/forum?id=0ze7XgWcYNV
910,Towards Uncertainties in Deep Learning that Are Accurate and Calibrated,https://openreview.net/forum?id=-0Cjhnl-dhK
911,Robust Models Are More Interpretable Because Attributions Look Normal,https://openreview.net/forum?id=FD8xldQIgdq
912,Trading Coverage for Precision: Conformal Prediction with Limited False Discoveries,https://openreview.net/forum?id=Gx6Tvlm-hWW
913,Communicating Natural Programs to Humans and Machines,https://openreview.net/forum?id=Z0XiFAb_WDr
914,AAVAE: Augmentation-Augmented Variational Autoencoders,https://openreview.net/forum?id=DHLngM1mR3W
915,SVMnet: Non-parametric image classification based on convolutional SVM ensembles for small training sets,https://openreview.net/forum?id=HFE5P8nhmmL
916,Yformer: U-Net Inspired Transformer Architecture for Far Horizon Time Series Forecasting,https://openreview.net/forum?id=dYUdt59fJ0e
917,Finite-Time Error Bounds for Distributed Linear Stochastic Approximation,https://openreview.net/forum?id=w8HXzn2FyKm
918,Pareto Navigation Gradient Descent: a First Order Algorithm for Optimization in Pareto Set,https://openreview.net/forum?id=tiKNfYpH8le
919,Federated Learning with Partial Model Personalization,https://openreview.net/forum?id=iFf26yMjRdN
920,Centroid Approximation for Bootstrap,https://openreview.net/forum?id=qynB_fAt5TQ
921,Bounding Membership Inference,https://openreview.net/forum?id=Mh40mAxxAUz
922,Training Multi-Layer Over-Parametrized Neural Network in Subquadratic Time,https://openreview.net/forum?id=OMxLn4t03FG
923,QTN-VQC: An End-to-End Learning Framework for Quantum Neural Networks,https://openreview.net/forum?id=EQ7A6F7k0r_
924,Monotonic Improvement Guarantees under Non-stationarity for Decentralized PPO,https://openreview.net/forum?id=uHv20yi8saL
925,Takeuchi's Information Criteria as Generalization Measures for DNNs Close to NTK Regime,https://openreview.net/forum?id=FH_mZOKFX-b
926,CheXT: Knowledge-Guided Cross-Attention Transformer for Abnormality Classification and Localization in Chest X-rays,https://openreview.net/forum?id=Y9FNtYulBE0
927,On-Target Adaptation,https://openreview.net/forum?id=6ooiNCGZa5K
928,Model Validation Using Mutated Training Labels: An Exploratory Study,https://openreview.net/forum?id=-6me0AsJVdu
929,Pruning Edges and Gradients to Learn Hypergraphs from Larger Sets,https://openreview.net/forum?id=7Z7u2z1Ornl
930,Language Modeling using LMUs: 10x Better Data Efficiency or Improved Scaling Compared to Transformers,https://openreview.net/forum?id=mQDpmgFKu1P
931,Soft Actor-Critic with Inhibitory Networks for Faster Retraining,https://openreview.net/forum?id=ngjR4Gw9oAp
932,Continual Backprop: Stochastic Gradient Descent with Persistent Randomness,https://openreview.net/forum?id=86sEVRfeGYS
933,Model-Efficient Deep Learning with Kernelized Classification,https://openreview.net/forum?id=30SXt3-vvnM
934,CausalDyna: Improving Generalization of Dyna-style Reinforcement Learning via Counterfactual-Based Data Augmentation,https://openreview.net/forum?id=uy602F8cTrh
935,Safe Deep RL in 3D Environments using Human Feedback,https://openreview.net/forum?id=-Txy_1wHJ4f
936,Learning to Infer the Structure of Network Games,https://openreview.net/forum?id=FqKolXKrQGA
937,Private Multi-Task Learning: Formulation and Applications to Federated Learning,https://openreview.net/forum?id=OBwsUF4nFye
938,On the Unreasonable Effectiveness of Feature Propagation in Learning on Graphs with Missing Node Features,https://openreview.net/forum?id=tx4qfdJSFvG
939,Grounding Aleatoric Uncertainty in Unsupervised Environment Design,https://openreview.net/forum?id=wYqLTy4wkor
940,On the Effectiveness of Quasi Character-Level Models for Machine Translation,https://openreview.net/forum?id=Pfj3SXBCbVQ
941,A Study of Aggregation of Long Time-series Input for LSTM Neural Networks,https://openreview.net/forum?id=fWK3qhAtbbk
942,"EfficientPhys: Enabling Simple, Fast, and Accurate Camera-Based Vitals Measurement",https://openreview.net/forum?id=7U-rmW7TPHM
943,Why do embedding spaces look as they do?,https://openreview.net/forum?id=j30wC0JM39Q
944,Optimized Separable Convolution: Yet Another Efficient Convolution Operator,https://openreview.net/forum?id=o8iGesI9HN-
945,Dynamic Graph Representation Learning via Graph Transformer Networks,https://openreview.net/forum?id=8rR8bIZnzMA
946,Neural Simulated Annealing,https://openreview.net/forum?id=bHqI0DvSIId
947,Generating High-Fidelity Privacy-Conscious Synthetic Patient Data for Causal Effect Estimation with Multiple Treatments,https://openreview.net/forum?id=TWTTKlwrUP0
948,Fast and Efficient Once-For-All Networks for Diverse Hardware Deployment,https://openreview.net/forum?id=ErsRrojuPzw
949,How to Improve Sample Complexity of SGD over Highly Dependent Data?,https://openreview.net/forum?id=-3yxxvDis3L
950,Bayesian Exploration for Lifelong Reinforcement Learning,https://openreview.net/forum?id=KBuOP5HrVQ0
951,Learning Equivariances and Partial Equivariances From Data,https://openreview.net/forum?id=jFfRcKVut98
952,Neural Tangent Kernel Empowered Federated Learning,https://openreview.net/forum?id=gdWQMQVJST
953,Federated Learning via Plurality Vote,https://openreview.net/forum?id=O9DAoNnYVlM
954,Implicit Regularization of Bregman Proximal Point Algorithm and Mirror Descent on Separable Data,https://openreview.net/forum?id=BkIV7EOXkSs
955,Restricted Category Removal from Model Representations using Limited Data,https://openreview.net/forum?id=Lv-G9XqLRRy
956,S3: Supervised Self-supervised Learning under Label Noise,https://openreview.net/forum?id=HY6i9FYBeFG
957,Robust Generalization of Quadratic Neural Networks via Function Identification,https://openreview.net/forum?id=Xx4MNjSmQQ9
958,SegTime: Precise Time Series Segmentation without Sliding Window,https://openreview.net/forum?id=FqMXxvHquTA
959,High Fidelity Visualization of What Your Self-Supervised Representation Knows About,https://openreview.net/forum?id=9Cwxjd6nRh
960,Neurosymbolic Deep Generative Models for Sequence Data with Relational Constraints,https://openreview.net/forum?id=dK_t8oN8G4
961,An Equivalence Between Data Poisoning and Byzantine Gradient Attacks,https://openreview.net/forum?id=7pZiaojaVGU
962,CIC: Contrastive Intrinsic Control for Unsupervised Skill Discovery,https://openreview.net/forum?id=kOtkgUGAVTX
963,Gradient-based Counterfactual Explanations using Tractable Probabilistic Models,https://openreview.net/forum?id=DrCsriMQ1o
964,KNIFE: Kernelized-Neural Differential Entropy Estimation,https://openreview.net/forum?id=a43otnDilz2
965,Mean-Variance Efficient Reinforcement Learning by Expected Quadratic Utility Maximization,https://openreview.net/forum?id=niZImJIrqVt
966,Better state exploration using action sequence equivalence,https://openreview.net/forum?id=NeRrtif_hfa
967,Local Permutation Equivariance For Graph Neural Networks,https://openreview.net/forum?id=7oyVOECcrt
968,Constrained Discrete Black-Box Optimization using Mixed-Integer Programming,https://openreview.net/forum?id=JV4tkMi4xg
969,Beyond Faithfulness: A Framework to Characterize and Compare Saliency Methods,https://openreview.net/forum?id=p7LSrQ3AADp
970,Variable Length Variable Quality Audio Steganography,https://openreview.net/forum?id=bVkRc9NDHcK
971,COLA: Consistent Learning with Opponent-Learning Awareness,https://openreview.net/forum?id=xbx7Hxjbd79
972,Physics Informed Convex Artificial Neural Networks (PICANNs) for Optimal Transport based Density Estimation,https://openreview.net/forum?id=qSTEPv2uLR8
973,Statistically Meaningful Approximation: a Theoretical Analysis for Approximating Turing Machines with Transformers,https://openreview.net/forum?id=uc8UsmcInvB
974,Classification and Uncertainty Quantification of Corrupted Data using Semi-Supervised Autoencoders,https://openreview.net/forum?id=bjYunHo6LWR
975,Dynamic and Efficient Gray-Box Hyperparameter Optimization for Deep Learning,https://openreview.net/forum?id=aBAgwom5pTn
976,Tight lower bounds for Differentially Private ERM,https://openreview.net/forum?id=30nbp1eV0dJ
977,Certified Adversarial Robustness Under the Bounded Support Set,https://openreview.net/forum?id=_HFPHFbJrP-
978,PRIMA: Planner-Reasoner Inside a Multi-task Reasoning Agent,https://openreview.net/forum?id=B6YDcqpMk30
979,Zero-Shot Recommender Systems,https://openreview.net/forum?id=y7tKDxxTo8T
980,That Escalated Quickly: Compounding Complexity by Editing Levels at the Frontier of Agent Capabilities,https://openreview.net/forum?id=rRg0ghtqRw2
981,Interest-based Item Representation Framework for Recommendation with Multi-Interests Capsule Network,https://openreview.net/forum?id=zFlFjoyOW-z
982,Token Pooling in Vision Transformers,https://openreview.net/forum?id=EGtUVDm991w
983,Reducing the Teacher-Student Gap via Adaptive Temperatures,https://openreview.net/forum?id=h-z_zqT2yJU
984,Mako: Semi-supervised continual learning with minimal labeled data via data programming,https://openreview.net/forum?id=gEynpztqZug
985,Exploring Covariate and Concept Shift for Detection and Confidence Calibration of Out-of-Distribution Data,https://openreview.net/forum?id=i3abvoMoeCZ
986,Greedy-based Value Representation for Efficient Coordination in Multi-agent Reinforcement Learning,https://openreview.net/forum?id=sEIl_stzQyB
987,An Empirical Study of Pre-trained Models on Out-of-distribution Generalization,https://openreview.net/forum?id=2RYOwBOFesi
988,Contrastive Pre-training for Zero-Shot Information Retrieval,https://openreview.net/forum?id=c7S4WIlmu5
989,Learning Structure from the Ground up---Hierarchical Representation Learning by Chunking,https://openreview.net/forum?id=c9IvZqZ8SNI
990,Understanding Overfitting in Reweighting Algorithms for Worst-group Performance,https://openreview.net/forum?id=twgEkDwFTP
991,ED2: An Environment Dynamics Decomposition Framework for World Model Construction,https://openreview.net/forum?id=FLa1RPjpm2L
992,How to measure deep uncertainty estimation performance and which models are naturally better at providing it,https://openreview.net/forum?id=LK8bvVSw6rn
993,Zeroth-Order Actor-Critic,https://openreview.net/forum?id=mF5tmqUfdsw
994,Surgical Prediction with Interpretable Latent Representation,https://openreview.net/forum?id=eZ-xMLuKPc
995,Unsupervised Object Learning via Common Fate,https://openreview.net/forum?id=YDqIYJBQTQs
996,Mix-MaxEnt: Creating High Entropy Barriers To Improve Accuracy and Uncertainty Estimates of Deterministic Neural Networks,https://openreview.net/forum?id=l431c_2eGO2
997,Surprise Minimizing Multi-Agent Learning with Energy-based Models,https://openreview.net/forum?id=6EVxJKlpGR
998,Regularizing Deep Neural Networks with Stochastic Estimators of Hessian Trace,https://openreview.net/forum?id=IptBMO1AR5g
999,Nested Policy Reinforcement Learning for Clinical Decision Support,https://openreview.net/forum?id=_67HnXYixmN
1000,Brittle interpretations: The Vulnerability of TCAV and Other Concept-based Explainability Tools to Adversarial Attack,https://openreview.net/forum?id=a3hQPNqIFk6
1001,Partial Information as Full: Reward Imputation with Sketching in Bandits,https://openreview.net/forum?id=Rj-x5_ej6B
1002,Source-Target Unified Knowledge Distillation for Memory-Efficient Federated Domain Adaptation on Edge Devices,https://openreview.net/forum?id=8rCMq0yJMG
1003,State-Action Joint Regularized Implicit Policy for Offline Reinforcement Learning,https://openreview.net/forum?id=-7UeX2KPqs
1004,Learning Representation for Bayesian Optimization with Collision-free Regularization,https://openreview.net/forum?id=e0TRvNWsVIH
1005,Adversarial Attacks on Spiking Convolutional Networks for Event-based Vision,https://openreview.net/forum?id=e0uknAgETh
1006,"EBM Life Cycle: MCMC Strategies for Synthesis, Defense, and Density Modeling",https://openreview.net/forum?id=psQ6wcNXjS1
1007,Intriguing Properties of Input-dependent Randomized Smoothing,https://openreview.net/forum?id=aJ9BXxg352
1008,Auditing AI models for Verified Deployment under Semantic Specifications,https://openreview.net/forum?id=zAyZFRptzvh
1009,INFERNO: Inferring Object-Centric 3D Scene Representations without Supervision,https://openreview.net/forum?id=YVa8X_2I1b
1010,Assessing two novel distance-based loss functions for few-shot image classification,https://openreview.net/forum?id=AdEM_SzfSd
1011,Implicit Bias of Linear Equivariant Networks,https://openreview.net/forum?id=zU2v47WF0Ku
1012,Imbalanced Adversarial Training with Reweighting,https://openreview.net/forum?id=Zae_OHNq-y
1013,Stabilized Self-training with Negative Sampling on Few-labeled Graph Data,https://openreview.net/forum?id=O_OJoU4_yj
1014,Self-GenomeNet: Self-supervised Learning with Reverse-Complement Context Prediction for Nucleotide-level Genomics Data,https://openreview.net/forum?id=92awwjGxIZI
1015,Learning to Solve Combinatorial Problems via Efficient Exploration,https://openreview.net/forum?id=olQbo52II9
1016,3D Pre-training improves GNNs for Molecular Property Prediction,https://openreview.net/forum?id=LNmNWds-q-J
1017,Learning Explicit Credit Assignment for Multi-agent Joint Q-learning,https://openreview.net/forum?id=AAeMQz0x4nA
1018,LEAN: graph-based pruning for convolutional neural networks by extracting longest chains,https://openreview.net/forum?id=xo_5lb5ond
1019,Automated Channel Pruning with Learned Importance,https://openreview.net/forum?id=Ab0o8YMJ8a
1020,Inductive Lottery Ticket Learning for Graph Neural Networks,https://openreview.net/forum?id=Bel1Do_eZC
1021,Neuron-Enhanced Autoencoder based Collaborative filtering: Theory and Practice,https://openreview.net/forum?id=pgKE5Q-CF2
1022,Improved Image Generation via Sparsity,https://openreview.net/forum?id=keeCvPPd3vL
1023,BIGRoC: Boosting Image Generation via a Robust Classifier,https://openreview.net/forum?id=FOfKpDnp2P
1024,Balancing Average and Worst-case Accuracy in Multitask Learning,https://openreview.net/forum?id=H_qwVb8DQb-
1025,Towards Learning to Speak and Hear Through Multi-Agent Communication over a Continuous Acoustic Channel,https://openreview.net/forum?id=0bXmbOt1oq
1026,PARS: PSEUDO-LABEL AWARE ROBUST SAMPLE SELECTION FOR LEARNING WITH NOISY LABELS,https://openreview.net/forum?id=ovRQmeVFbrC
1027,Interactive Model with Structural Loss for Language-based Abductive Reasoning,https://openreview.net/forum?id=7TFcl1Xkr7
1028,Model Compression via Symmetries of the Parameter Space,https://openreview.net/forum?id=8MN_GH4Ckp4
1029,CAGE: Probing Causal Relationships in Deep Generative Models,https://openreview.net/forum?id=VCD05OEn7r
1030,Invariance-Guided Feature Evolution for Few-Shot Learning,https://openreview.net/forum?id=Ltkwl64I91
1031,Local Reweighting for Adversarial Training,https://openreview.net/forum?id=tJhIY38d2TS
1032,Discovering the neural correlate informed nosological relation among multiple neuropsychiatric disorders through dual utilisation of diagnostic information,https://openreview.net/forum?id=fM8VzFD_2-
1033,Continuous Control with Action Quantization from Demonstrations,https://openreview.net/forum?id=i2baoZMYZ3
1034,Self-Contrastive Learning,https://openreview.net/forum?id=krI-ahhgN2
1035,Personalized Neural Architecture Search for Federated Learning,https://openreview.net/forum?id=WcZUevpX3H3
1036,Structure by Architecture: Disentangled Representations without Regularization,https://openreview.net/forum?id=ue4CArRAsct
1037,Deep learning via message passing algorithms based on belief propagation,https://openreview.net/forum?id=1-YP2squpa7
1038,Adam is no better than normalized SGD: Dissecting how adaptivity improves GAN performance,https://openreview.net/forum?id=D9SuLzhgK9
1039,Defect Transfer GAN: Diverse Defect Synthesis for Data Augmentation,https://openreview.net/forum?id=2hMEdc35xZ6
1040,Intrusion-Free Graph Mixup,https://openreview.net/forum?id=ybsh6zEzIKA
1041,Reachability Traces for Curriculum Design in Reinforcement Learning,https://openreview.net/forum?id=DXRwVRh4i8g
1042,Towards understanding how momentum improves generalization in deep learning,https://openreview.net/forum?id=lf0W6tcWmh-
1043,GSmooth: Certified Robustness against Semantic Transformations via Generalized Randomized Smoothing,https://openreview.net/forum?id=U9zTUXVdoIr
1044,Disentangled generative models for robust dynamical system prediction,https://openreview.net/forum?id=vpiOnyOBTzQ
1045,"Truth Table Deep Convolutional Neural Network, A New SAT-Encodable Architecture - Application To Complete Robustness",https://openreview.net/forum?id=jJJWwrMrEsx
1046,Online approximate factorization of a kernel matrix by a Hebbian neural network,https://openreview.net/forum?id=e8JI3SBZKa4
1047,Imperceptible Black-box Attack via Refining in Salient Region,https://openreview.net/forum?id=o86_622j0sb
1048,EinSteinVI: General and Integrated Stein Variational Inference,https://openreview.net/forum?id=qNcedShvOs4
1049,YOUR AUTOREGRESSIVE GENERATIVE MODEL CAN BE BETTER IF YOU TREAT IT AS AN ENERGY-BASED ONE,https://openreview.net/forum?id=1Zxv7TdLquI
1050,Can Reinforcement Learning Efficiently Find Stackelberg-Nash Equilibria in General-Sum Markov Games?,https://openreview.net/forum?id=Ih0iJBSy4eq
1051,Memory-Constrained Policy Optimization,https://openreview.net/forum?id=7yuU9VeIpde
1052,AI-SARAH: Adaptive and Implicit Stochastic Recursive Gradient Methods,https://openreview.net/forum?id=sk63PSiUyci
1053,Intervention Adversarial Auto-Encoder,https://openreview.net/forum?id=5SgoJKayTvs
1054,Causal discovery from conditionally stationary time-series,https://openreview.net/forum?id=q9zIvzRaU94
1055,Dissecting Local Properties of Adversarial Examples,https://openreview.net/forum?id=-AW3SFO63GO
1056,Video Forgery Detection Using Multiple Cues on Fusion of EfficientNet and Swin Transformer,https://openreview.net/forum?id=K3uRhaKJuZg
1057,Understanding the Interaction of Adversarial Training with Noisy Labels,https://openreview.net/forum?id=wIK1fWFXvU9
1058,Abelian Neural Networks,https://openreview.net/forum?id=DzKPXXr-CLK
1059,Neural Manifold Clustering and Embedding,https://openreview.net/forum?id=ZDYhm_o8MX
1060,Fully Decentralized Model-based Policy Optimization with Networked Agents,https://openreview.net/forum?id=aYSlxlHKEA
1061,Finding lost DG: Explaining domain generalization via model complexity,https://openreview.net/forum?id=o6dG7nVYDS
1062,Best Practices in Pool-based Active Learning for Image Classification,https://openreview.net/forum?id=7Rnf1F7rQhR
1063,Towards Unsupervised Content Disentanglement in Sentence Representations via Syntactic Roles,https://openreview.net/forum?id=fyLvrx9M9YP
1064,Analytically Tractable Bayesian Deep Q-Learning,https://openreview.net/forum?id=AJO2mBSTOHl
1065,Learning Neural Causal Models with Active Interventions,https://openreview.net/forum?id=e_FK_rDajEv
1066,Adaptive Inertia: Disentangling the Effects of Adaptive Learning Rate and Momentum,https://openreview.net/forum?id=7vcKot39bsv
1067,Contrastively Enforcing Distinctiveness for Multi-Label Classification,https://openreview.net/forum?id=jNsynsmDkl
1068,Non-Denoising Forward-Time Diffusions,https://openreview.net/forum?id=oVfIKuhqfC
1069,Neuronal Learning Analysis using Cycle-Consistent Adversarial Networks,https://openreview.net/forum?id=eiwpbi3iwr
1070,Succinct Compression: Near-Optimal and Lossless Compression of Deep Neural Networks during Inference Runtime,https://openreview.net/forum?id=zHZ1mvMUMW8
1071,Transfer and Marginalize: Explaining Away Label Noise with Privileged Information,https://openreview.net/forum?id=f3qFAV_MH-C
1072,Two Regimes of Generalization for Non-Linear Metric Learning,https://openreview.net/forum?id=zPLQSnfd14w
1073,Graph Convolutional Networks via Adaptive Filter Banks,https://openreview.net/forum?id=yztpblfGkZ-
1074,Unsupervised Pose-Aware Part Decomposition for 3D Articulated Objects,https://openreview.net/forum?id=dLDzuxaN0Hd
1075,L2BGAN: An image enhancement model for image quality improvement and image analysis tasks without paired supervision,https://openreview.net/forum?id=kO-wQWwqnO
1076,Towards Structured Dynamic Sparse Pre-Training of BERT,https://openreview.net/forum?id=-e7awdzWsOc
1077,Understanding Knowledge Integration in Language Models with Graph Convolutions,https://openreview.net/forum?id=3XD_rnM97s
1078,The Manifold Hypothesis for Gradient-Based Explanations,https://openreview.net/forum?id=dmq_-R2LhQk
1079,Multivariate Time Series Forecasting with Latent Graph Inference,https://openreview.net/forum?id=JpNH4CW_zl
1080,Exploring Non-Contrastive Representation Learning for Deep Clustering,https://openreview.net/forum?id=JZrETJlgyq
1081,Automatic Concept Extraction for Concept Bottleneck-based Video Classification,https://openreview.net/forum?id=66kgCIYQW3
1082,MLP-based architecture with variable length input for automatic speech recognition,https://openreview.net/forum?id=RA-zVvZLYIy
1083,Natural Attribute-based Shift Detection,https://openreview.net/forum?id=tsg-Lf1MYp
1084,"Towards Physical, Imperceptible Adversarial Attacks via Adversarial Programs",https://openreview.net/forum?id=RB_2cor6d-w
1085,D$^2$-GCN: Data-Dependent GCNs for Boosting Both Efficiency and Scalability,https://openreview.net/forum?id=0J98XyjlQ1
1086,AF$_2$: Adaptive Focus Framework for Aerial Imagery Segmentation,https://openreview.net/forum?id=FCxWzalZp9N
1087,BCDR: Betweenness Centrality-based Distance Resampling for Graph Shortest Distance Embedding,https://openreview.net/forum?id=mk8AzPcd3x
1088,Tractable Dendritic RNNs for Identifying Unknown Nonlinear Dynamical Systems,https://openreview.net/forum?id=AVShGWiL9z
1089,Sparse Hierarchical Table Ensemble,https://openreview.net/forum?id=24N4XH2NaYq
1090,Combining Differential Privacy and Byzantine Resilience in Distributed SGD,https://openreview.net/forum?id=bM45i3LQBdl
1091,When high-performing models behave poorly in practice: periodic sampling can help,https://openreview.net/forum?id=9kBDWEmA6i
1092,Align-RUDDER: Learning From Few Demonstrations by Reward Redistribution,https://openreview.net/forum?id=AlPBx2zq7Jt
1093,$p$-Laplacian Based Graph Neural Networks,https://openreview.net/forum?id=i8d2kdxii1L
