,title,link
657,Fast Deterministic Stackelberg Actor-Critic,https://openreview.net/forum?id=xVlPHwnNKv
658,A Free Lunch from the Noise: Provable and Practical Exploration for Representation Learning,https://openreview.net/forum?id=f6CQliwyra
659,Equal Experience in Recommender Systems,https://openreview.net/forum?id=_ysluXvD1M
660,Generating Novel Scene Compositions from Single Images and Videos,https://openreview.net/forum?id=6uu1t8jQ-M
661,Off-Policy Reinforcement Learning with Delayed Rewards,https://openreview.net/forum?id=nsjkNB2oKsQ
662,Adversarial robustness against multiple $l_p$-threat models at the price of one and how to quickly fine-tune robust models to another threat model,https://openreview.net/forum?id=KoCzLK1Hugc
663,Distributed Skellam Mechanism: a Novel Approach to Federated Learning with Differential Privacy,https://openreview.net/forum?id=gWGexz8hFH
664,Adaptive Label Smoothing with Self-Knowledge,https://openreview.net/forum?id=wgR0BQfG5vi
665,Do Androids Dream of Electric Fences? Safety-Aware Reinforcement Learning with Latent Shielding,https://openreview.net/forum?id=6hTObFz_nB
666,Sharp Learning Bounds for Contrastive Unsupervised Representation Learning,https://openreview.net/forum?id=tDirSp3pczB
667,Understanding the robustness-accuracy tradeoff by rethinking robust fairness,https://openreview.net/forum?id=bl9zYxOVwa
668,Diverse and Consistent Multi-view Networks for Semi-supervised Regression,https://openreview.net/forum?id=J9_7t9m8xRj
669,Revisiting Layer-wise Sampling in Fast Training for Graph Convolutional Networks,https://openreview.net/forum?id=RRj7DcsPjT
670,Knowledge Based Multilingual Language Model,https://openreview.net/forum?id=SCSonHu4p0W
671,Fact-driven Logical Reasoning,https://openreview.net/forum?id=gKWxifgJVP
672,The Infinite Contextual Graph Markov Model,https://openreview.net/forum?id=Rupm2vTg1pe
673,Uncertainty-based out-of-distribution detection requires suitable function space priors,https://openreview.net/forum?id=u7UxOTefG2
674,SplitRegex: Faster Regex Synthesis via Neural Example Splitting,https://openreview.net/forum?id=EJKLVMB_9T
675,Wavelet Feature Maps Compression for Low Bandwidth Convolutional Neural Networks,https://openreview.net/forum?id=R3Y9yq49seb
676,Learning Dynamics Models for Model Predictive Agents,https://openreview.net/forum?id=lNreaMZf9X
677,Pretrained models are active learners,https://openreview.net/forum?id=AkJyAE46GA
678,On Margin Maximization in Linear and ReLU Networks,https://openreview.net/forum?id=auLXcGlEOZ7
679,Gradient-based Meta-solving and Its Applications to Iterative Methods for Solving Differential Equations,https://openreview.net/forum?id=Kmsf3z-vGu
680,GRODIN: Improved Large-Scale Out-of-Domain detection via Back-propagation,https://openreview.net/forum?id=T73sfhfzk07
681,AIR-Net: Adaptive and Implicit Regularization Neural Network for matrix completion,https://openreview.net/forum?id=xf0B7-7MRo6
682,Equivariant Vector Field Network for Many-body System Modeling,https://openreview.net/forum?id=G33_uTwQiL
683,Adaptive Generalization for Semantic Segmentation,https://openreview.net/forum?id=1O5UK-zoK8g
684,"Context-invariant, multi-variate time series representations",https://openreview.net/forum?id=7sz69eztw9
685,DiBB: Distributing Black-Box Optimization,https://openreview.net/forum?id=WYDzDksK5b
686,Subspace State-Space Identification and Model Predictive Control of Nonlinear Dynamical Systems Using Deep Neural Network with Bottleneck,https://openreview.net/forum?id=e-JV6H8lwpl
687,"One Thing to Fool them All: Generating Interpretable, Universal, and Physically-Realizable Adversarial Features",https://openreview.net/forum?id=9dn7CjyTFoS
688,Deep Active Learning by Leveraging Training Dynamics,https://openreview.net/forum?id=8XM-AXMnAk_
689,Modelling neuronal behaviour with time series regression: Recurrent Neural Networks on synthetic C. elegans data,https://openreview.net/forum?id=k-sNDIPY-1T
690,Knothe-Rosenblatt transport for Unsupervised Domain Adaptation,https://openreview.net/forum?id=5fmBRf5rrC
691,Detecting Modularity in Deep Neural Networks,https://openreview.net/forum?id=tFQyjbOz34
692,Feature Flow Regularization: Improving Structured Sparsity in Deep Neural Networks,https://openreview.net/forum?id=_ZoDJyBBp7z
693,Towards fast and effective single-step adversarial training,https://openreview.net/forum?id=fRnRsdc_nR7
694,Long Document Summarization with Top-Down and Bottom-Up Representation Inference,https://openreview.net/forum?id=xiXOrugVHs
695,Function-Space Variational Inference for Deep Bayesian Classification,https://openreview.net/forum?id=5o7lEUYRvM
696,SALT : Sharing Attention between Linear layer and Transformer for tabular dataset,https://openreview.net/forum?id=LgjKqSjDzr
697,Scalable Hierarchical Embeddings of Complex Networks,https://openreview.net/forum?id=U-GB_gONqbo
698,CoLLIE: Continual Learning of Language Grounding from Language-Image Embeddings,https://openreview.net/forum?id=DzBDB7y8UOy
699,Two Sides of the Same Coin: Heterophily and Oversmoothing in Graph Convolutional Neural Networks,https://openreview.net/forum?id=R2aCiGQ9Qc
700,Neural Implicit Representations for Physical Parameter Inference from a Single Video,https://openreview.net/forum?id=T_p1vd88T87
701,Adaptive Q-learning for Interaction-Limited Reinforcement Learning,https://openreview.net/forum?id=zhynF6JnC4q
702,Practical and Private Heterogeneous Federated Learning,https://openreview.net/forum?id=pIjvdJ_QUYv
703,Should we Replace CNNs with Transformers for Medical Images?,https://openreview.net/forum?id=3Wybo29gGlx
704,Bit-aware Randomized Response for Local Differential Privacy in Federated Learning,https://openreview.net/forum?id=ZUXZKjfptc9
705,Self-Distribution Distillation: Efficient Uncertainty Estimation,https://openreview.net/forum?id=DYaFB19z1ig
706,Addressing the Stability-Plasticity Dilemma via Knowledge-Aware Continual Learning,https://openreview.net/forum?id=lD8qAOTu5FJ
707,Continual Learning in Deep Networks: an Analysis of the Last Layer,https://openreview.net/forum?id=R2AN-rz4j_X
708,Multi-Task Neural Processes,https://openreview.net/forum?id=wfRZkDvxOqj
709,Dataset transformations trade-offs to adapt machine learning methods across domains,https://openreview.net/forum?id=GdPZJxjk46V
710,Unit Ball Model for Embedding Hierarchical Structures in the Complex Hyperbolic Space,https://openreview.net/forum?id=dvl241Sbrda
711,Transformer with a Mixture of Gaussian Keys,https://openreview.net/forum?id=i1ogYhs0ByT
712,A Collaborative Attention Adaptive Network for Financial Market Forecasting,https://openreview.net/forum?id=lEB5Dnz_MmH
713,Wakening Past Concepts without Past Data: Class-incremental Learning from Placebos,https://openreview.net/forum?id=Y8Ivdg7typR
714,Symmetric Machine Theory of Mind,https://openreview.net/forum?id=ZnUwk6i_iTR
715,Learning Neural Implicit Functions as Object Representations for Robotic Manipulation,https://openreview.net/forum?id=I-nQMZfQz7F
716,Spatio-temporal Disentangled representation learning for mobility prediction,https://openreview.net/forum?id=2g9m74He1Ky
717,Double Descent in Adversarial Training: An Implicit Label Noise Perspective,https://openreview.net/forum?id=-h5rboREox7
718,How Does the Task Landscape Affect MAML Performance?,https://openreview.net/forum?id=zuDmDfeoB_1
719,Data Quality Matters For Adversarial Training: An Empirical Study,https://openreview.net/forum?id=EXe93Md8RqS
720,Interactively Generating Explanations for Transformer Language Models,https://openreview.net/forum?id=vDa28vlSBCP
721,Physics-Informed Neural Operator for Learning Partial Differential Equations,https://openreview.net/forum?id=dtYnHcmQKeM
722,Test-Time Adaptation to Distribution Shifts by Confidence Maximization and Input Transformation,https://openreview.net/forum?id=uVTp9Z-IUOC
723,Predictive Maintenance for Optical Networks in Robust Collaborative Learning,https://openreview.net/forum?id=PHugX0j2xcE
724,How memory architecture affects learning in a simple POMDP: the two-hypothesis testing problem,https://openreview.net/forum?id=hxitw01k_Ql
725,Empirical Study of the Decision Region and Robustness in Deep Neural Networks,https://openreview.net/forum?id=gULyf2IVll0
726,Detecting Adversarial Examples Is (Nearly) As Hard As Classifying Them,https://openreview.net/forum?id=QJb1-8NH2Ux
727,Re-evaluating Word Mover's Distance,https://openreview.net/forum?id=yOBqNg-CqB0
728,Weakly-Supervised Learning of Disentangled and Interpretable Skills for Hierarchical Reinforcement Learning,https://openreview.net/forum?id=yhjfOvBvvmz
729,Accelerating HEP simulations with Neural Importance Sampling,https://openreview.net/forum?id=V0LnyelKACB
730,Reinforcement Learning with Ex-Post Max-Min Fairness,https://openreview.net/forum?id=JYQYysrNT3M
731,CLOOB: Modern Hopfield Networks with InfoLOOB Outperform CLIP,https://openreview.net/forum?id=qw674L9PfQE
732,Constituency Tree Representation for Argument Unit Recognition,https://openreview.net/forum?id=roxWnqcguNq
733,BioLCNet: Reward-modulated Locally Connected Spiking Neural Networks,https://openreview.net/forum?id=zeGpMIt6Pfq
734,Confidence-aware Training of Smoothed Classifiers for Certified Robustness,https://openreview.net/forum?id=qLqeb9AjD2o
735,Distributional Perturbation for Efficient Exploration in Distributional Reinforcement Learning,https://openreview.net/forum?id=rGg-Qcyplgq
736,HydraSum - Disentangling Stylistic Features in Text Summarization using Multi-Decoder Models,https://openreview.net/forum?id=Le8fg2ppDSv
737,Automatic Termination for Hyperparameter Optimization,https://openreview.net/forum?id=2NqIV8dzR7N
738,Domain-wise Adversarial Training for Out-of-Distribution Generalization,https://openreview.net/forum?id=3Od_-TkEdnG
739,Graph Kernel Neural Networks,https://openreview.net/forum?id=5fbUEUTZEn7
740,Particle Based Stochastic Policy Optimization,https://openreview.net/forum?id=KUmMSZ_r28W
741,Learning from One and Only One Shot,https://openreview.net/forum?id=F2r3wYar3Py
742,Debiasing Pretrained Text Encoders by Paying Attention to Paying Attention,https://openreview.net/forum?id=ygGMP1zkiD1
743,An Efficient and Reliable Tolerance-Based Algorithm for Principal Component Analysis,https://openreview.net/forum?id=viWF5cyz6i
744,Self-supervised Learning for Sequential Recommendation with Model Augmentation,https://openreview.net/forum?id=4YOOO4ZNKM
745,Self-supervised regression learning using domain knowledge: Applications to improving self-supervised image denoising,https://openreview.net/forum?id=M2sNIiCC6C
746,Independent Component Alignment for Multi-task Learning,https://openreview.net/forum?id=uF_Wl0xSA7O
747,Understanding Square Loss in Training Overparametrized Neural Network Classifiers,https://openreview.net/forum?id=N3KYKkSvciP
748,Decentralized Cross-Entropy Method for Model-Based Reinforcement Learning,https://openreview.net/forum?id=yql6px0bcT
749,Robust and Personalized Federated Learning with Spurious Features: an Adversarial Approach,https://openreview.net/forum?id=SF9o3-yP1WR
750,Momentum Conserving Lagrangian Neural Networks,https://openreview.net/forum?id=OD_dnx57ksK
751,Object-Centric Neural Scene Rendering,https://openreview.net/forum?id=Uy6YEI9-6v
752,Online Tuning for Offline Decentralized Multi-Agent Reinforcement Learning,https://openreview.net/forum?id=0VezzBzLmBr
753,Offline Decentralized Multi-Agent Reinforcement Learning,https://openreview.net/forum?id=87Ks7PvYVJi
754,Self-Supervised Structured Representations for Deep Reinforcement Learning,https://openreview.net/forum?id=lyzRAErG6Kv
755,Conditional set generation using Seq2seq models,https://openreview.net/forum?id=q23I9kJE3gA
756,Low-Precision Stochastic Gradient Langevin Dynamics,https://openreview.net/forum?id=XhMa8XPHxpw
757,Batch size-invariance for policy optimization,https://openreview.net/forum?id=IR-V6-aP-mv
758,A Branch and Bound Framework for Stronger Adversarial Attacks of ReLU Networks,https://openreview.net/forum?id=oxwsctgY5da
759,Speech-MLP: a simple MLP architecture for speech processing,https://openreview.net/forum?id=-u8EliRNW8k
760,Guided-TTS:Text-to-Speech with Untranscribed Speech,https://openreview.net/forum?id=CgV7NVOgDJZ
761,Evaluating Predictive Distributions: Does Bayesian Deep Learning Work?,https://openreview.net/forum?id=S7vWxSkqv_M
762,BLOOD: Bi-level Learning Framework for Out-of-distribution Generalization,https://openreview.net/forum?id=Cm08egNmrl3
763,FoveaTer: Foveated Transformer for Image Classification,https://openreview.net/forum?id=mqIeP6qPvta
764,Adversarial twin neural networks: maximizing physics recovery for physical system,https://openreview.net/forum?id=7WVAI3dRwhR
765,Learning Two-Step Hybrid Policy for Graph-Based Interpretable Reinforcement Learning,https://openreview.net/forum?id=1kqWZlj4QYJ
766,ZerO Initialization: Initializing Residual Networks with only Zeros and Ones,https://openreview.net/forum?id=EYCm0AFjaSS
767,Learning to Model Editing Processes,https://openreview.net/forum?id=1bEaEzGwfhP
768,Edge Partition Modulated Graph Convolutional Networks,https://openreview.net/forum?id=ET1UAOYeU42
769,LASSO: Latent Sub-spaces Orientation for Domain Generalization,https://openreview.net/forum?id=QbFfqWAEmMr
770,Pruning Compact ConvNets For Efficient Inference,https://openreview.net/forum?id=_gZ8dG4vOr9
771,Label Smoothed Embedding Hypothesis for Out-of-Distribution Detection,https://openreview.net/forum?id=YtdASzotUEW
772,On the Safety of Interpretable Machine Learning: A Maximum Deviation Approach,https://openreview.net/forum?id=Jt8FYFnyTLR
773,Generating Antimicrobial Peptides from Latent Secondary Structure Space,https://openreview.net/forum?id=ajOSNLwqssu
774,Improving Meta-Continual Learning Representations with Representation Replay,https://openreview.net/forum?id=7kOsYRp4EmB
775,Indiscriminate Poisoning Attacks Are Shortcuts,https://openreview.net/forum?id=8e2vrVvvaeQ
776,PIVQGAN: Posture and Identity Disentangled Image-to-Image Translation via Vector Quantization,https://openreview.net/forum?id=c60vFLXEwED
777,SpSC: A Fast and Provable Algorithm for Sampling-Based GNN Training,https://openreview.net/forum?id=vRhkfX8G_H9
778,Neural Structure Mapping For Learning Abstract Visual Analogies,https://openreview.net/forum?id=By5Uwd_xzNF
779,How does Contrastive Pre-training Connect Disparate Domains?,https://openreview.net/forum?id=vBn2OXZuQCF
780,GCF: Generalized Causal Forest for Heterogeneous Treatment Effect Estimation Using Nonparametric Methods,https://openreview.net/forum?id=ugxdsne_TlO
781,One Objective for All Models --- Self-supervised Learning for Topic Models,https://openreview.net/forum?id=nuWpS9FNSKn
782,ShiftAddNAS: Hardware-Inspired Search for More Accurate and Efficient Neural Networks,https://openreview.net/forum?id=CZZ7KWOP0-M
783,Learning to perceive objects by prediction,https://openreview.net/forum?id=IsHQmuOqRAG
784,IA-MARL: Imputation Assisted Multi-Agent Reinforcement Learning for Missing Training Data,https://openreview.net/forum?id=BNIt2myzSzS
785,ES-Based Jacobian Enables Faster Bilevel Optimization,https://openreview.net/forum?id=LczpUPwCnR1
786,Knowledge Guided Geometric Editing for Unsupervised Drug Design,https://openreview.net/forum?id=91muTwt1_t5
787,Graph Information Matters: Understanding Graph Filters from Interaction Probability,https://openreview.net/forum?id=Ee2ugKwgvyy
788,Feature Selection in the Contrastive Analysis Setting,https://openreview.net/forum?id=P-gDXxGYCib
789,Disentangling Generalization in Reinforcement Learning,https://openreview.net/forum?id=fUhxuop_Q1r
790,Code Editing from Few Exemplars by Adaptive Multi-Extent Composition,https://openreview.net/forum?id=i7O3VGpb7qZ
791,Active Learning over Multiple Domains in Natural Language Tasks,https://openreview.net/forum?id=yuv0mwPOlz3
792,Provable Federated Adversarial Learning via Min-max Optimization,https://openreview.net/forum?id=RAoBtzlwtCC
793,Less is More: Dimension Reduction Finds On-Manifold Adversarial Examples in Hard-Label Attacks,https://openreview.net/forum?id=0Q6BzWbvg0P
794,Exploring and Evaluating Personalized Models for Code Generation,https://openreview.net/forum?id=_55bCXzj3D9
795,Near-Optimal Algorithms for Autonomous Exploration and Multi-Goal Stochastic Shortest Path,https://openreview.net/forum?id=SjGRJ4vSZlP
796,Bypassing Logits Bias in Online Class-Incremental Learning with a Generative Framework,https://openreview.net/forum?id=ZumkmSpY9G4
797,G-Mixup: Graph Augmentation for Graph Classification,https://openreview.net/forum?id=dIVrWHP9_1i
798,Local Patch AutoAugment with Multi-Agent Collaboration,https://openreview.net/forum?id=RuC5ilX2m6O
799,"Learning Visual-Linguistic Adequacy, Fidelity, and Fluency for Novel Object Captioning",https://openreview.net/forum?id=gtvM-nBZEbc
800,Text Generation with Efficient (Soft) $Q$-Learning,https://openreview.net/forum?id=9TdCcMlmsLm
801,Variational Component Decoder for Source Extraction from Nonlinear Mixture,https://openreview.net/forum?id=gmxgG6_BL_N
802,Deep Representations for Time-varying Brain Datasets,https://openreview.net/forum?id=IEsx-jwFk3g
803,"Towards Understanding Distributional Reinforcement Learning: Regularization, Optimization, Acceleration and Sinkhorn Algorithm",https://openreview.net/forum?id=nK7eZEURiJ4
804,Efficient Out-of-Distribution Detection via CVAE data Generation,https://openreview.net/forum?id=JvPopr9skL0
805,FedDrop: Trajectory-weighted Dropout for Efficient Federated Learning,https://openreview.net/forum?id=obi9EkyVeED
806,SeqPATE: Differentially Private Text Generation via Knowledge Distillation,https://openreview.net/forum?id=5sP_PUUS78v
807,Multi-Resolution Continuous Normalizing Flows,https://openreview.net/forum?id=WN2Sup7qLdw
808,OVD-Explorer: A General Information-theoretic Exploration Approach for Reinforcement Learning,https://openreview.net/forum?id=-YAqAIsxr7v
809,Non-convex Optimization for Learning a Fair Predictor under Equalized Loss Fairness Constraint,https://openreview.net/forum?id=vtDzHJOsmfJ
810,Deep Reinforcement Learning for Equal Risk Option Pricing and Hedging under Dynamic Expectile Risk Measures,https://openreview.net/forum?id=O5Wr-xX0U2y
811,Learning Stochastic Shortest Path with Linear Function Approximation,https://openreview.net/forum?id=adjl32ogfqD
812,Data Scaling Laws in NMT: The Effect of Noise and Architecture,https://openreview.net/forum?id=AB2r0YKBSpD
813,Learning to Give Checkable Answers with Prover-Verifier Games,https://openreview.net/forum?id=FqRHeQTDU5N
814,Max-Affine Spline Insights Into Deep Network Pruning,https://openreview.net/forum?id=7vXQJ2QW8hR
815,Learning Neural Acoustic Fields,https://openreview.net/forum?id=lkQ7meEa-qv
816,iPrune: A Magnitude Based Unstructured Pruning Method for Efficient Binary Networks in Hardware,https://openreview.net/forum?id=m4BAEB_Imy
817,Benign Overfitting in Adversarially Robust Linear Classification,https://openreview.net/forum?id=HI99z0aLsl
818,Learnability and Expressiveness in Self-Supervised Learning,https://openreview.net/forum?id=SCn0mgEIwh
819,Anarchic Federated Learning,https://openreview.net/forum?id=ijygjHyhcFp
820,Weakly Supervised Graph Clustering,https://openreview.net/forum?id=gaYko_Y2_l
821,On the regularization landscape for the linear recommendation models,https://openreview.net/forum?id=djZBr4Z7jcz
822,Simpler Calibration for Survival Analysis,https://openreview.net/forum?id=bB6YLDJewoK
823,TIME-LAPSE: Learning to say â€œI don't knowâ€ through spatio-temporal uncertainty scoring,https://openreview.net/forum?id=XpmTU4k-5uf
824,Representation Consolidation from Multiple Expert Teachers,https://openreview.net/forum?id=_faKHAwA8O
825,Combining Diverse Feature Priors,https://openreview.net/forum?id=gccdzDu5Ur
826,AQUILA: Communication Efficient Federated Learning with Adaptive Quantization of Lazily-Aggregated Gradients,https://openreview.net/forum?id=cdZLe5S0ur
827,Inducing Reusable Skills From Demonstrations with Option-Controller Network,https://openreview.net/forum?id=62r41yOG5m
828,Plug-In Inversion: Model-Agnostic Inversion for Vision with Data Augmentations,https://openreview.net/forum?id=RVdN1-eDZ1b
829,Few-Shot Classification with Task-Adaptive Semantic Feature Learning,https://openreview.net/forum?id=T1A11E__Az
830,NODEAttack: Adversarial Attack on the Energy Consumption of Neural ODEs,https://openreview.net/forum?id=r88Isj2alz
831,On Transportation of Mini-batches: A Hierarchical Approach,https://openreview.net/forum?id=YRDlrT00BP
832,A Simple and Debiased Sampling Method for Personalized Ranking,https://openreview.net/forum?id=ldkunzUzRWj
833,Repairing Systematic Outliers by Learning Clean Subspaces in VAEs,https://openreview.net/forum?id=kHNKTO2sYH
834,Stability analysis of SGD through the normalized loss function,https://openreview.net/forum?id=2I1wy0y6xo
835,Gradient Broadcast Adaptation: Defending against the backdoor attack in pre-trained models,https://openreview.net/forum?id=aKZeBGUJXlH
836,Eigenspace Restructuring: a Principle of Space and Frequency in Neural Networks,https://openreview.net/forum?id=NZQ8aTScT1-
837,Theoretical Analysis of Consistency Regularization with Limited Augmented Data,https://openreview.net/forum?id=IbyMcLKUCqT
838,Counting Substructures with Higher-Order Graph Neural Networks: Possibility and Impossibility Results,https://openreview.net/forum?id=-RAFyM-YPj
839,Meta-Learning Dynamics Forecasting Using Task Inference,https://openreview.net/forum?id=B7O85qTDgU4
840,Message Function Search for Hyper-relational Knowledge Graph,https://openreview.net/forum?id=CQzlxFVcmw1
841,Transformers are Meta-Reinforcement Learners,https://openreview.net/forum?id=H7Edu1_IZgR
842,GARNET: A Spectral Approach to Robust and Scalable Graph Neural Networks,https://openreview.net/forum?id=UeRmyymo3kb
843,Apollo: An Adaptive Parameter-wised Diagonal Quasi-Newton Method for Nonconvex Stochastic Optimization,https://openreview.net/forum?id=WwKv20NrsfB
844,Semi-supervised Long-tailed Recognition using Alternate Sampling,https://openreview.net/forum?id=vr4Wo33bd1
845,A Closer Look at Prototype Classifier for Few-shot Image Classification,https://openreview.net/forum?id=ptxGmKMLH_
846,Multi-agent Performative Prediction: From Global Stability and Optimality to Chaos,https://openreview.net/forum?id=-Nf6TikpjQ
847,Dynamic Least-Squares Regression,https://openreview.net/forum?id=zBhwgP7kt4
848,Conjugation Invariant Learning with Neural Networks,https://openreview.net/forum?id=VABfTTrrOv
849,"Generate, Annotate, and Learn: Generative Models Advance Self-Training and Knowledge Distillation",https://openreview.net/forum?id=oC12z8lkbrU
850,$\alpha$-Weighted Federated Adversarial Training,https://openreview.net/forum?id=vxlAHR9AyZ6
851,Learning with convolution and pooling operations in kernel methods,https://openreview.net/forum?id=93SVBUB1r5C
852,Revisiting and Advancing Fast Adversarial Training Through the lens of Bi-Level Optimization,https://openreview.net/forum?id=gzeruP-0J29
853,Second-Order Rewards For Successor Features,https://openreview.net/forum?id=L2jrxKBloq8
854,Gating Mechanisms Underlying Sequence-to-Sequence Working Memory,https://openreview.net/forum?id=-fORBF5k2ZB
855,Randomized Primal-Dual Coordinate Method for Large-scale Linearly Constrained Nonsmooth Nonconvex Optimization,https://openreview.net/forum?id=n1BMcctC12
856,A Risk-Sensitive Policy Gradient Method,https://openreview.net/forum?id=9rKTy4oZAQt
857,Perturbation Deterioration: The Other Side of Catastrophic Overfitting,https://openreview.net/forum?id=c8AvdRAyVkz
858,Stability based Generalization Bounds for Exponential Family Langevin Dynamics,https://openreview.net/forum?id=tzO3RXxzuM
859,Meta-free few-shot learning via representation learning with weight averaging,https://openreview.net/forum?id=DrpKmCmPMSC
860,NAS-Bench-360: Benchmarking Diverse Tasks for Neural Architecture Search,https://openreview.net/forum?id=ZOjKx9dEmLB
861,An Interpretable Graph Generative Model with Heterophily,https://openreview.net/forum?id=qQuzhbU3Gto
862,Test Time Robustification of Deep Models via Adaptation and Augmentation,https://openreview.net/forum?id=J1uOGgf-bP
863,ACTIVE REFINEMENT OF WEAKLY SUPERVISED MODELS,https://openreview.net/forum?id=IPy3URgH47U
864,SemiRetro: Semi-template framework boosts deep retrosynthesis prediction,https://openreview.net/forum?id=rMbLORc8oS
865,Style Equalization: Unsupervised Learning of Controllable Generative Sequence Models,https://openreview.net/forum?id=aMaQjwz5IXI
866,DEUP: Direct Epistemic Uncertainty Prediction,https://openreview.net/forum?id=Jep2ykGUdS
867,Why be adversarial? Let's cooperate!: Cooperative Dataset Alignment via JSD Upper Bound,https://openreview.net/forum?id=kcadk-DShNO
868,Image Compression and Classification Using Qubits and Quantum Deep Learning,https://openreview.net/forum?id=t1QXzSGwr9
869,Fully Online Meta-Learning Without Task Boundaries,https://openreview.net/forum?id=THMafOyRVpE
870,Weakly Supervised Label Learning Flows,https://openreview.net/forum?id=Y8KfxdZl-rI
871,"Divergent representations of ethological visual inputs emerge from supervised, unsupervised, and reinforcement learning",https://openreview.net/forum?id=UXwlFxVWks
872,SABAL: Sparse Approximation-based Batch Active Learning,https://openreview.net/forum?id=SZRqWWB4AAh
873,Permutation invariant graph-to-sequence model for template-free retrosynthesis and reaction prediction,https://openreview.net/forum?id=LLHwQh9zEb
874,Intra-class Mixup for Out-of-Distribution Detection,https://openreview.net/forum?id=HRL6el2SBQ
875,Explaining Off-Policy Actor-Critic From A Bias-Variance Perspective,https://openreview.net/forum?id=ZAA0Ol4z2i4
876,Neural Circuit Architectural Priors for Embodied Control,https://openreview.net/forum?id=XSwpJ2bonX
877,DEEP GRAPH TREE NETWORKS,https://openreview.net/forum?id=VQhFC3Ki5C
