,title,link
436,Motion Planning Transformers: One Model to Plan them All,https://openreview.net/forum?id=6Jf6HX4MoLH
437,SparRL: Graph Sparsification via Deep Reinforcement Learning,https://openreview.net/forum?id=dut7suZoRqv
438,Rewardless Open-Ended Learning (ROEL),https://openreview.net/forum?id=g4nVdxU9RK
439,The Needle in the haystack: Out-distribution aware Self-training in an Open-World Setting,https://openreview.net/forum?id=f9JwVXMJ1Up
440,Multi-Agent Reinforcement Learning with Shared Resource in Inventory Management,https://openreview.net/forum?id=-uZp67PZ7p
441,Representing value functions in power systems using parametric network series,https://openreview.net/forum?id=H4EXaI6HR2
442,Task-oriented Dialogue System for Automatic Disease Diagnosis via Hierarchical Reinforcement Learning,https://openreview.net/forum?id=8kVP8m93VqN
443,GAETS: A Graph Autoencoder Time Series Approach Towards Battery Parameter Estimation,https://openreview.net/forum?id=2z5h4hY-LQ
444,FitVid: High-Capacity Pixel-Level Video Prediction,https://openreview.net/forum?id=iim-R8xu0TG
445,Generative Posterior Networks for Approximately Bayesian Epistemic Uncertainty Estimation,https://openreview.net/forum?id=WZeI0Vro15y
446,FlowX: Towards Explainable Graph Neural Networks via Message Flows,https://openreview.net/forum?id=mRF387I4Wl
447,On Learning with Fairness Trade-Offs,https://openreview.net/forum?id=kamUXjlAZuw
448,An Empirical Investigation of the Role of Pre-training in Lifelong Learning,https://openreview.net/forum?id=D9E8MKsfhw
449,Continual Learning of Neural Networks for Realtime Wireline Cable Position Inference,https://openreview.net/forum?id=7MLeqJrHNa
450,Benchmarking Machine Learning Robustness in Covid-19 Spike Sequence Classification,https://openreview.net/forum?id=V7eSbSAz-O8
451,DIGRAC: Digraph Clustering Based on Flow Imbalance,https://openreview.net/forum?id=QmKblFEgQJ
452,NUQ: Nonparametric Uncertainty Quantification for Deterministic Neural Networks,https://openreview.net/forum?id=saNgDizIODl
453,Xi-learning: Successor Feature Transfer Learning for General Reward Functions,https://openreview.net/forum?id=YDud6vPh2V
454,Help Me Explore: Minimal Social Interventions for Graph-Based Autotelic Agents,https://openreview.net/forum?id=9u5E8AFudRx
455,Privacy Auditing of Machine Learning using Membership Inference Attacks,https://openreview.net/forum?id=EG5Pgd7-MY
456,Generalization of GANs and overparameterized models under Lipschitz continuity,https://openreview.net/forum?id=G0CuTynjgQa
457,AutoMO-Mixer: An automated multi-objective multi-layer perspecton Mixer model for medical image based diagnosis,https://openreview.net/forum?id=rbFPSQHlllm
458,Faster Reinforcement Learning with Value Target Lower Bounding,https://openreview.net/forum?id=bgAS1ZvveZ
459,Hessian-Free High-Resolution Nesterov Acceleration for Sampling,https://openreview.net/forum?id=gdegUuC_fxR
460,BANANA: a Benchmark for the Assessment of Neural Architectures for Nucleic Acids,https://openreview.net/forum?id=Pobz_8y2Q2_
461,Model-Based Robust Adaptive Semantic Segmentation,https://openreview.net/forum?id=fStt6fyzrK
462,Improving zero-shot generalization in offline reinforcement learning using generalized similarity functions,https://openreview.net/forum?id=pC00NfsvnSK
463,Sample-efficient actor-critic algorithms with an etiquette for zero-sum Markov games,https://openreview.net/forum?id=mniwiEAuzL
464,Towards the Memorization Effect of Neural Networks in Adversarial Training,https://openreview.net/forum?id=gc8zLQWf2k
465,Match Prediction Using Learned History Embeddings,https://openreview.net/forum?id=d2XZsOT-_U_
466,Invariance Through Inference,https://openreview.net/forum?id=vXGcHthY6v
467,Invariant Causal Mechanisms through Distribution Matching,https://openreview.net/forum?id=C81udlH5yMv
468,Compound Multi-branch Feature Fusion for Real Image Restoration,https://openreview.net/forum?id=WQIdU90Gsu
469,An Optimization Perspective on Realizing Backdoor Injection Attacks on Deep Neural Networks in Hardware,https://openreview.net/forum?id=NHHM1jjrH1
470,Learn the Time to Learn: Replay Scheduling for Continual Learning,https://openreview.net/forum?id=cD0O_Sc-wNy
471,Foreground-attention in neural decoding: Guiding Loop-Enc-Dec to reconstruct visual stimulus images from fMRI,https://openreview.net/forum?id=lEoFUoMH2Uu
472,Soteria: In search of efficient neural networks for private inference,https://openreview.net/forum?id=SbV8J9JHb6
473,Orthogonalising gradients to speedup neural network optimisation,https://openreview.net/forum?id=-cII-Vju5C
474,Non-Parametric Neuro-Adaptive Control Subject to Task Specifications,https://openreview.net/forum?id=FWiwSGJ_Bpa
475,Accelerating Optimization using Neural Reparametrization,https://openreview.net/forum?id=ab7fanwXWu
476,Losing Less: A Loss for Differentially Private Deep Learning,https://openreview.net/forum?id=u7PVCewFya
477,Teamwork makes von Neumann work:Min-Max Optimization in Two-Team Zero-Sum Games,https://openreview.net/forum?id=UyBxDoukIB
478,Learning Graph Representations for Influence Maximization,https://openreview.net/forum?id=UJ9_wmscwk
479,Iterative Decoding for Compositional Generalization in Transformers,https://openreview.net/forum?id=Rh3khfuQUYk
480,The Low-Rank Simplicity Bias in Deep Networks,https://openreview.net/forum?id=dn4B7Mes2z
481,Evaluating generative networks using Gaussian mixtures of image features,https://openreview.net/forum?id=YedA6OCN6X
482,CONTROLLING THE MEMORABILITY OF REAL AND UNREAL FACE IMAGES,https://openreview.net/forum?id=tm9-r3-O2lt
483,Regularized-OFU: an efficient algorithm for general contextual bandit with optimization oracles,https://openreview.net/forum?id=yXBb-0cPSKO
484,Fast and Sample-Efficient Domain Adaptation for Autoencoder-Based End-to-End Communication,https://openreview.net/forum?id=S6eHczgYpnu
485,Mistake-driven Image Classification with FastGAN and SpinalNet,https://openreview.net/forum?id=ChKNCDB0oYj
486,Finding One Missing Puzzle of Contextual Word Embedding: Representing Contexts as Manifold,https://openreview.net/forum?id=m7zsaLt1Sab
487,On the benefits of deep RL in accelerated MRI sampling,https://openreview.net/forum?id=fRb9LBWUo56
488,Automatic Forecasting via Meta-Learning,https://openreview.net/forum?id=UTdxT0g6ZuC
489,Reconstructing Word Embeddings via Scattered $k$-Sub-Embedding,https://openreview.net/forum?id=MqEcDNQwOSA
490,Understanding Sharpness-Aware Minimization,https://openreview.net/forum?id=qXa0nhTRZGV
491,Path-specific Causal Fair Prediction via Auxiliary Graph Structure Learning,https://openreview.net/forum?id=sWqjiqlUDso
492,VoiceFixer: Toward General Speech Restoration with Neural Vocoder,https://openreview.net/forum?id=G-7GlfTneYg
493,DNN Quantization with Attention,https://openreview.net/forum?id=uwnOHjgUrTa
494,Language Model Pre-training on True Negatives,https://openreview.net/forum?id=lP11WtZwquE
495,Exploiting Minimum-Variance Policy Evaluation for Policy Optimization,https://openreview.net/forum?id=5y35LXrRMMz
496,TempoRL: Temporal Priors for Exploration in Off-Policy Reinforcement Learning,https://openreview.net/forum?id=HG7vlodGGm
497,"Gradient play in stochastic games: stationary points, convergence, and sample complexity",https://openreview.net/forum?id=GrvigKxc13E
498,Federated Robustness Propagation: Sharing Adversarial Robustness in Federated Learning,https://openreview.net/forum?id=3AkuJOgL_X
499,Concentric Spherical GNN for 3D Representation Learning,https://openreview.net/forum?id=qpcG27kYK6z
500,Triangular Dropout: Variable Network Width without Retraining,https://openreview.net/forum?id=B7abCaIiN_v
501,Learning Rate Grafting: Transferability of Optimizer Tuning,https://openreview.net/forum?id=FpKgG31Z_i9
502,Stability and Generalisation in Batch Reinforcement Learning,https://openreview.net/forum?id=0GhVG1de-Iv
503,Analyzing the Effects of Classifier Lipschitzness on Explainers,https://openreview.net/forum?id=mTcO4-QCOB
504,Contrastive Embeddings for Neural Architectures,https://openreview.net/forum?id=Rivn22SJjg9
505,Learning Invariant Reward Functions through Trajectory Interventions,https://openreview.net/forum?id=QFNIpIrkANz
506,On the Convergence of Nonconvex Continual Learning with Adaptive Learning Rate,https://openreview.net/forum?id=CTOJRqLMsl
507,Direct Molecular Conformation Generation,https://openreview.net/forum?id=kcrIligNnl
508,Generalization in Deep RL for TSP Problems via Equivariance and Local Search,https://openreview.net/forum?id=TLnReGgZEdW
509,ScheduleNet: Learn to solve multi-agent scheduling problems with reinforcement learning,https://openreview.net/forum?id=nWlk4jwupZ
510,Neurally boosted supervised spectral clustering,https://openreview.net/forum?id=OGbbY4qmir5
511,Label Refining: a semi-supervised method to extract voice characteristics without ground truth,https://openreview.net/forum?id=CpgtwW8GBxe
512,Boosting Search Engines with Interactive Agents,https://openreview.net/forum?id=di0r7vfKrq5
513,Examining Scaling and Transfer of Language Model Architectures for Machine Translation,https://openreview.net/forum?id=PlFtf_pnkZu
514,Disentangling Sources of Risk for Distributional Multi-Agent Reinforcement Learning,https://openreview.net/forum?id=5qwA7LLbgP0
515,Normalized Attention Without Probability Cage,https://openreview.net/forum?id=PeG-8G5ua3W
516,Learning Pseudometric-based Action Representations for Offline Reinforcement Learning,https://openreview.net/forum?id=naoQDOYsHnS
517,Localized Randomized Smoothing for Collective Robustness Certification,https://openreview.net/forum?id=mF122BuAnnW
518,Divide and Explore: Multi-Agent Separate Exploration with Shared Intrinsic Motivations,https://openreview.net/forum?id=NgmcJ66xQz_
519,Adversarial Robustness as a Prior for Learned Representations,https://openreview.net/forum?id=SVcEx6SC_NL
520,Noise-Contrastive Variational Information Bottleneck Networks,https://openreview.net/forum?id=El9kZ2caYVy
521,On Reward Maximization and Distribution Matching for Fine-Tuning Language Models,https://openreview.net/forum?id=8f95ajHrIFc
522,Building the Building Blocks: From Simplification to Winning Trees in Genetic Programming,https://openreview.net/forum?id=CC-BbehJKTe
523,The magnitude vector of images,https://openreview.net/forum?id=-3Qj7Jl6UP5
524,Quasi-potential theory for escape problem: Quantitative sharpness effect on SGD's escape from local minima,https://openreview.net/forum?id=vLz0e9S-iF3
525,Containerized Distributed Value-Based Multi-Agent Reinforcement Learning,https://openreview.net/forum?id=psNSQsmd4JI
526,Few-shot graph link prediction with domain adaptation,https://openreview.net/forum?id=yrD7B9N_54F
527,Improved Generalization Bound for Deep Neural Networks Using Geometric Functional Analysis,https://openreview.net/forum?id=_B8Jd7Nqs7R
528,$G^3$: Representation Learning and Generation for Geometric Graphs,https://openreview.net/forum?id=Q42O1Qaho5N
529,What can multi-cloud configuration learn from AutoML?,https://openreview.net/forum?id=ZgrmzzYjMc4
530,Continuous Deep Q-Learning in Optimal Control Problems: Normalized Advantage Functions Analysis,https://openreview.net/forum?id=TVs3zZOOZ8t
531,EVaDE : Event-Based Variational Thompson Sampling for Model-Based Reinforcement Learning,https://openreview.net/forum?id=z8xVlqWwRrK
532,Discovering Classification Rules for Interpretable Learning with Linear Programming,https://openreview.net/forum?id=KLh86DknDj7
533,ParaDiS: Parallelly Distributable Slimmable Neural Networks,https://openreview.net/forum?id=nCw4talHmo5
534,Complex Locomotion Skill Learning via Differentiable Physics,https://openreview.net/forum?id=YpBHDlalKDG
535,HyperCGAN: Text-to-Image Synthesis with HyperNet-Modulated Conditional Generative Adversarial Networks,https://openreview.net/forum?id=z-5BjnU3-OQ
536,Objective Evaluation of Deep Visual Interpretations on Time Series Data,https://openreview.net/forum?id=CBchIgBBrwj
537,SPLID: Self-Imitation Policy Learning through Iterative Distillation,https://openreview.net/forum?id=67T66kchK_7
538,Multi-Objective Online Learning,https://openreview.net/forum?id=YfFWrndRGQx
539,GIR Framework: Learning Graph Positional Embeddings with Anchor Indication and Path Encoding,https://openreview.net/forum?id=jT5vnpqlrSN
540,Evolving Neural Update Rules for Sequence Learning,https://openreview.net/forum?id=F9McnN1dITx
541,Distributed Zeroth-Order Optimization: Convergence Rates That Match Centralized Counterpart,https://openreview.net/forum?id=z2B0JJeNdvT
542,Hypothesis Driven Coordinate Ascent for Reinforcement Learning,https://openreview.net/forum?id=uoBAKAFkVKx
543,Logic Pre-Training of Language Models,https://openreview.net/forum?id=1gEb_H1DEqZ
544,Scaling Fair Learning to Hundreds of Intersectional Groups,https://openreview.net/forum?id=yjxVspo7gXt
545,Zero-Cost Operation Scoring in Differentiable Architecture Search,https://openreview.net/forum?id=8QE3pwEVc8P
546,Experience Replay More When It's a Key Transition in Deep Reinforcement Learning,https://openreview.net/forum?id=IhkSFe9YqMy
547,Contrastive Attraction and Contrastive Repulsion for Representation Learning,https://openreview.net/forum?id=66miN107dRS
548,"Network robustness as a mathematical property: training, evaluation and attack",https://openreview.net/forum?id=VAmkgdMztWs
549,Distribution-Driven Disjoint Prediction Intervals for Deep Learning,https://openreview.net/forum?id=gD0KBsQcGKg
550,MS$^2$-Transformer: An End-to-End Model for MS/MS-assisted Molecule Identification,https://openreview.net/forum?id=XK4GN6UCTfH
551,MetaBalance: High-Performance Neural Networks for Class-Imbalanced Data,https://openreview.net/forum?id=M-9bPO0M2K5
552,On Adversarial Bias and the Robustness of Fair Machine Learning,https://openreview.net/forum?id=BKmoW5K4sS
553,Beyond Examples: Constructing Explanation Space for Explaining Prototypes,https://openreview.net/forum?id=2cpsEstmH1
554,Learning Global Spatial Information for Multi-View Object-Centric Models,https://openreview.net/forum?id=3mm5rjb7nR8
555,Coarformer: Transformer for large graph via graph coarsening,https://openreview.net/forum?id=fkjO_FKVzw
556,Delving into Feature Space: Improving Adversarial Robustness by Feature Spectral Regularization,https://openreview.net/forum?id=qWhajfmKEUt
557,Revisiting Virtual Nodes in Graph Neural Networks for Link Prediction,https://openreview.net/forum?id=ETiaOyNwJW
558,Distributionally Robust Recourse Action,https://openreview.net/forum?id=m22XrToDacC
559,Evolutionary perspective on model fine-tuning,https://openreview.net/forum?id=w7Nb5dSMM-
560,An object-centric sensitivity analysis of deep learning based instance segmentation,https://openreview.net/forum?id=C5Q04gnc4f
561,TAG: Task-based Accumulated Gradients for Lifelong learning,https://openreview.net/forum?id=KVhvw16pvi
562,Gradient Explosion and Representation Shrinkage in Infinite Networks,https://openreview.net/forum?id=GesLOTU_r23
563,Meta-Learning an Inference Algorithm for Probabilistic Programs,https://openreview.net/forum?id=XyVXPuuO_P
564,Calibrated ensembles - a simple way to mitigate ID-OOD accuracy tradeoffs,https://openreview.net/forum?id=WIJVRV7jnTX
565,Variance Reduced Domain Randomization for Policy Gradient,https://openreview.net/forum?id=vnF5gDNvcKX
566,Relative Molecule Self-Attention Transformer,https://openreview.net/forum?id=7ktHTjV9FHw
567,Bag-of-Vectors Autoencoders for Unsupervised Conditional Text Generation,https://openreview.net/forum?id=8IXBbFjkMat
568,FedGEMS: Federated Learning of Larger Server Models via Selective Knowledge Fusion,https://openreview.net/forum?id=QguFu30t0d
569,Flow-based Recurrent Belief State Learning for POMDPs,https://openreview.net/forum?id=xtZXWpXVbiK
570,Cluster-based Feature Importance Learning for Electronic Health Record Time-series,https://openreview.net/forum?id=kroqZZb-6s
571,Marginal Tail-Adaptive Normalizing Flows,https://openreview.net/forum?id=per0G3dnkYh
572,Effective Polynomial Filter Adaptation for Graph Neural Networks,https://openreview.net/forum?id=fJIrkNKGBNI
573,On the relationship between disentanglement and multi-task learning,https://openreview.net/forum?id=1JN7MepVDFv
574,Lightweight Convolutional Neural Networks By Hypercomplex Parameterization,https://openreview.net/forum?id=S5qdnMhf7R
575,Adversarial Rademacher Complexity of Deep Neural Networks,https://openreview.net/forum?id=wNsNT56zDkG
576,Bayesian Active Learning with Fully Bayesian Gaussian Processes,https://openreview.net/forum?id=vyn49BUAkoD
577,Effective Uncertainty Estimation with Evidential Models for Open-World Recognition,https://openreview.net/forum?id=NrB52z3eOTY
578,Loss meta-learning for forecasting,https://openreview.net/forum?id=rczz7TUKIIB
579,Towards Understanding Data Values: Empirical Results on Synthetic Data,https://openreview.net/forum?id=9q3g_5gQbbA
580,Bolstering Stochastic Gradient Descent with Model Building,https://openreview.net/forum?id=alaQzRbCY9w
581,Dense-to-Sparse Gate for Mixture-of-Experts,https://openreview.net/forum?id=_4D8IVs7yO8
582,Thinking Deeper With Recurrent Networks: Logical Extrapolation Without Overthinking,https://openreview.net/forum?id=kDF4Owotj5j
583,Tessellated 2D Convolution Networks: A Robust Defence against Adversarial Attacks,https://openreview.net/forum?id=LtI14EpWKH
584,"Manifold Distance Judge, an Adversarial Samples Defense Strategy Based on Service Orchestration",https://openreview.net/forum?id=f3QTgKQW0TD
585,Understanding Graph Learning with Local Intrinsic Dimensionality,https://openreview.net/forum?id=DaQVj6qY2-s
586,Langevin Autoencoders for Learning Deep Latent Variable Models,https://openreview.net/forum?id=GIEPR9OomyX
587,Sampling from Discrete Energy-Based Models with Quality/Efficiency Trade-offs,https://openreview.net/forum?id=9zcjXdavnX
588,Lottery Image Prior,https://openreview.net/forum?id=Rx9luEzcSoy
589,Improving Neural Network Generalization via Promoting Within-Layer Diversity,https://openreview.net/forum?id=RQIvNJDHwy
590,Federated Learning with GAN-based Data Synthesis for Non-IID Clients,https://openreview.net/forum?id=8rpv8g3zfF
591,Learning an Ethical Module for Bias Mitigation of pre-trained Models,https://openreview.net/forum?id=R3zqNwzAVsC
592,Stepping Back to SMILES Transformers for Fast Molecular Representation Inference,https://openreview.net/forum?id=CyKQiiCPBEv
593,Interventional Black-Box Explanations,https://openreview.net/forum?id=97WDkHzofx
594,WaveCorr: Deep Reinforcement Learning with Permutation Invariant Policy Networks for Portfolio Management,https://openreview.net/forum?id=Zca3NK3X8G
595,Determining the Ethno-nationality of Writers Using Written English Text,https://openreview.net/forum?id=bq7smM1OJIX
596,Bit-wise Training of Neural Network Weights,https://openreview.net/forum?id=gxk4-rVATDA
597,Spatial Frequency Sensitivity Regularization for Robustness,https://openreview.net/forum?id=inA3szzFE5
598,Go with the Flow: the distribution of information processing in multi-path networks,https://openreview.net/forum?id=MvtLspSX324
599,"When in Doubt, Summon the Titans: A Framework for Efficient Inference with Large Models",https://openreview.net/forum?id=AgDwZa1AiJt
600,Protect the weak: Class focused online learning for adversarial training,https://openreview.net/forum?id=0uZu36la_y4
601,CSQ: Centered Symmetric Quantization for Extremely Low Bit Neural Networks,https://openreview.net/forum?id=dtt435G80Ng
602,Closed-Loop Control of Additive Manufacturing via Reinforcement Learning,https://openreview.net/forum?id=0SiVrAfIxOe
603,Fast and Reliable Evaluation of Adversarial Robustness with Minimum-Margin Attack,https://openreview.net/forum?id=Kvbr8NicKq
604,The Connection between Out-of-Distribution Generalization and Privacy of ML Models,https://openreview.net/forum?id=R11xJsRjA-W
605,A New Perspective on Fluid Simulation: An Image-to-Image Translation Task via Neural Networks,https://openreview.net/forum?id=0DecTiJFbm
606,On Pseudo-Labeling for Class-Mismatch Semi-Supervised Learning,https://openreview.net/forum?id=kHkWgqOysk_
607,Multi-Agent Language Learning: Symbolic Mapping,https://openreview.net/forum?id=6ya8C6sCiD
608,Self-Organized Polynomial-time Coordination Graphs,https://openreview.net/forum?id=T_8wHvOkEi9
609,M6-10T: A Sharing-Delinking Paradigm for Efficient Multi-Trillion Parameter Pretraining,https://openreview.net/forum?id=TXqemS7XEH
610,Meta-Forecasting by combining Global Deep Representations with Local Adaptation,https://openreview.net/forum?id=EIm_pvFJx5k
611,A Fair Generative Model Using Total Variation Distance,https://openreview.net/forum?id=F1Z3QH-VjZE
612,ViViT: Curvature access through the generalized Gauss-Newton's low-rank structure,https://openreview.net/forum?id=e_D6AmszH4P
613,Boosting the Transferability of Adversarial Attacks with Reverse Adversarial Perturbation,https://openreview.net/forum?id=i7FNvHnPvPc
614,What classifiers know what they don't know?,https://openreview.net/forum?id=f9AIc3mEprf
615,Superior Performance with Diversified Strategic Control in FPS Games Using General Reinforcement Learning,https://openreview.net/forum?id=tvwNdOKhuF5
616,Role Diversity Matters: A Study of Cooperative Training Strategies for Multi-Agent RL,https://openreview.net/forum?id=0HkFxvSRDSW
617,Trident Pyramid Networks: The importance of processing at the feature pyramid level for better object detection,https://openreview.net/forum?id=327eol9Xgyi
618,Implicit Jacobian regularization weighted with impurity of probability output,https://openreview.net/forum?id=RQ3xUXjZWMO
619,Supervised Permutation Invariant Networks for solving the CVRP with bounded fleet size,https://openreview.net/forum?id=4l5iO9eoh3f
620,Differentiable Top-k Classification Learning,https://openreview.net/forum?id=6PTUd_zPdHL
621,Network Learning in Quadratic Games from Fictitious Plays,https://openreview.net/forum?id=8kpSWDgzsh0
622,Enhancing semi-supervised learning via self-interested coalitional learning,https://openreview.net/forum?id=iGffRQ9jQpQ
623,The Effect of diversity in Meta-Learning,https://openreview.net/forum?id=97r5Y5DrJTo
624,Graph Barlow Twins: A self-supervised representation learning framework for graphs,https://openreview.net/forum?id=MRGFutr0p5e
625,ON THE GENERALIZATION OF WASSERSTEIN ROBUST FEDERATED LEARNING,https://openreview.net/forum?id=nWprF5r2spe
626,Disentangling deep neural networks with rectified linear units using duality,https://openreview.net/forum?id=tlkHrUlNTiL
627,SLASH: Embracing Probabilistic Circuits into Neural Answer Set Programming,https://openreview.net/forum?id=0U0C2pXfTZl
628,PROMISSING: Pruning Missing Values in Neural Networks,https://openreview.net/forum?id=M_o5E088xO5
629,Approximating Instance-Dependent Noise via Instance-Confidence Embedding,https://openreview.net/forum?id=qPzR-M6HY8x
630,Robustmix: Improving Robustness by Regularizing the Frequency Bias of Deep Nets,https://openreview.net/forum?id=f-KGT01Qze0
631,Decoupled Kernel Neural Processes: Neural Network-Parameterized Stochastic Processes using Explicit Data-driven Kernel,https://openreview.net/forum?id=fHPdmN3I0tY
632,DPP-TTS: Diversifying prosodic features of speech via determinantal point processes,https://openreview.net/forum?id=u6sUACr7feW
633,Explanatory Learning: Beyond Empiricism in Neural Networks,https://openreview.net/forum?id=46lmrnVBHBL
634,Model Fusion of Heterogeneous Neural Networks via Cross-Layer Alignment,https://openreview.net/forum?id=AFH3FnBksHT
635,Red Alarm for Pre-trained Models: Universal Vulnerability to Neuron-Level Backdoor Attacks,https://openreview.net/forum?id=vdKncX1WclT
636,Structured Uncertainty in the Observation Space of Variational Autoencoders,https://openreview.net/forum?id=Qu_XudmGajz
637,Model-Based Opponent Modeling,https://openreview.net/forum?id=n6Bc3YElODq
638,Learning to Persuade,https://openreview.net/forum?id=0oSM3TC9Z5a
639,TotalRecall: A Bidirectional Candidates Generation Framework for Large Scale Recommender \& Advertising Systems,https://openreview.net/forum?id=r4PibJdCyn
640,Equivalence of State Equations from Different Methods in High-dimensional Regression,https://openreview.net/forum?id=Bd8JSwLVWQ5
641,High Precision Score-based Diffusion Models,https://openreview.net/forum?id=qHsuiKXkUb
642,Maximum Likelihood Training of Parametrized Diffusion Model,https://openreview.net/forum?id=1v1N7Zhmgcx
643,A Statistical Manifold Framework for Point Cloud Data,https://openreview.net/forum?id=Tubzedlc4P
644,Contrastive Representation Learning for 3D Protein Structures,https://openreview.net/forum?id=VINWzIM6_6
645,Inverse Contextual Bandits: Learning How Behavior Evolves over Time,https://openreview.net/forum?id=xw04RdwI2kS
646,Inferring Offensiveness In Images From Natural Language Supervision,https://openreview.net/forum?id=gCmCiclZV6Q
647,Lagrangian Method for Episodic Learning,https://openreview.net/forum?id=H3zl1mDHDTn
648,Koopman Q-learning: Offline Reinforcement Learning via Symmetries of Dynamics,https://openreview.net/forum?id=q1QmAqT_4Zh
649,$\sbf{\delta^2}$-exploration for Reinforcement Learning,https://openreview.net/forum?id=pQ02Y-onvZA
650,EXPLAINABLE AI-BASED DYNAMIC FILTER PRUNING OF CONVOLUTIONAL NEURAL NETWORKS,https://openreview.net/forum?id=vQmIksuciu2
651,ClsVC: Learning Speech Representations with two different classification tasks.,https://openreview.net/forum?id=xp2D-1PtLc5
652,Divergence-Regularized Multi-Agent Actor-Critic,https://openreview.net/forum?id=tQ2yZj4sCnk
653,Network Pruning Optimization by Simulated Annealing Algorithm,https://openreview.net/forum?id=2jYxq9_TkpG
654,Bootstrapped Hindsight Experience replay with Counterintuitive Prioritization,https://openreview.net/forum?id=AsyICRrQ7Lp
655,Correct-N-Contrast: a Contrastive Approach for Improving Robustness to Spurious Correlations,https://openreview.net/forum?id=cVak2hs06z
656,Robust Imitation via Mirror Descent Inverse Reinforcement Learning,https://openreview.net/forum?id=Hg7xLoENqHW
